code,parent_code,budget_income,budget_expense,COD_INS_CAR_TRA,NOMB_CTA_CONT_CENT,TIPO_CUEN_CONT,NATURA_SALDO,TIENE_SUBCTA,NIVEL,TIPO_EJEC_PTO_INGR,TIPO_EJEC_PTO_EGRE,TIP_FLU_FDO_DEB,TIP_FLU_FDO_HAB,id_temporal,longitud,parent_id,budget_income_id_temporal,budget_expense_id_temporal
22617,226,0,0,,Derechos por Servicios Diversos a Proyectos de Inversión,A,D,N,4,0,0,0,0,2454,5,2421,0,0
22617001,22617,0,0,,Derechos por Servicios Diversos a Proyectos de Inversión,A,D,N,5,0,0,0,0,2455,8,2454,0,0
22619,226,0,0,,Descuentos en Ventas de Titulosvalores,A,D,S,4,0,0,0,0,2456,5,2421,0,0
22619001,22619,0,0,,Descuentos en Ventas de Títulosvalores,A,D,N,5,0,0,0,0,2457,8,2456,0,0
22621,226,0,0,,Cargos por Devolución de Impuesto Pagados en Exceso,A,D,N,4,0,0,0,0,2458,5,2421,0,0
22621001,22621,0,0,,Notas de Crédito del Tesoro Público,A,D,N,5,0,0,0,0,2459,8,2458,0,0
22623,226,0,0,,Cargos por Convenios en Subsidios,A,D,N,4,0,0,0,0,2460,5,2421,0,0
22623001,22623,0,0,,Notas de Crédito del Tesoro Público,A,D,N,5,0,0,0,0,2461,8,2460,0,0
22624,226,0,0,,Cargos por Convenios de Obligaciones,A,D,N,4,0,0,0,0,2462,5,2421,0,0
22624001,22624,0,0,,ANDA Deuda con Distribuidoras de Energía Eléctrica,A,D,N,5,0,0,0,0,2463,8,2462,0,0
22625,226,0,0,,Derechos por Convenios en Subsidios,A,D,N,4,0,0,0,0,2464,5,2421,0,0
22625001,22625,0,0,,Subsidio G.L.P.,A,D,N,5,0,0,0,0,2465,8,2464,0,0
22627,226,0,0,,Cargos Temporales por Reserva Tècnica,A,D,N,4,0,0,0,0,2466,5,2421,0,0
22627001,22627,0,0,,Cargos Temporales por Reserva Tècnica,A,D,N,5,0,0,0,0,2467,8,2466,0,0
22629,226,0,0,,Cargos por Contribuciones Legales,A,D,N,4,0,0,0,0,2468,5,2421,0,0
22629001,22629,0,0,,Cargos por Contribuciones Legales,A,D,N,5,0,0,0,0,2469,8,2468,0,0
22630,226,0,0,,Derechos por Promociones,A,D,N,4,0,0,0,0,2470,5,2421,0,0
22630001,22630,0,0,,Derechos por Promociones,A,D,N,5,0,0,0,0,2471,8,2470,0,0
22698,226,0,0,,Cargos por Contribuciones Estatales a Instituciones de Seguridad Social,A,D,S,4,0,0,0,0,2472,5,2421,0,0
22698001,22698,0,0,,Cargos por Contribuciones Estatales a Instituciones de Seguridad Social,A,D,N,5,0,0,0,0,2473,8,2472,0,0
22699,226,0,0,,Amortizaciones Acumuladas,A,A,S,4,0,0,0,0,2474,5,2421,0,0
22699001,22699,0,0,,Amortizaciones Acumuladas,A,A,N,5,0,0,0,0,2475,8,2474,0,0
227,22,0,0,,Bienes y Servicios Pagados por Anticipado,A,D,N,3,0,0,0,0,2476,3,2089,0,0
22701,227,0,0,,Estudios de Investigación y Desarrollo,A,D,N,4,0,0,0,0,2477,5,2476,0,0
22701001,22701,0,0,,Estudios de Investigación y Desarrollo,A,D,N,5,0,0,0,0,2478,8,2477,0,0
22703,227,0,0,,Gastos de Organización y Puesta en Marcha,A,D,N,4,0,0,0,0,2479,5,2476,0,0
22703001,22703,0,0,,Gastos de Organización y Puesta en Marcha,A,D,N,5,0,0,0,0,2480,8,2479,0,0
22705,227,0,556,,Seguros Pagados por Anticipado,A,D,N,4,0,1,0,0,2481,5,2476,0,730
22705001,22705,0,55601,,Primas y Gastos de Seguros de Personas,A,D,N,5,0,1,0,0,2482,8,2481,0,731
22705002,22705,0,55602,,Primas y Gastos de Seguros de Bienes,A,D,N,5,0,1,0,0,2483,8,2481,0,732
22705003,22705,0,55603,,Comisiones y Gastos Bancarios,A,D,N,5,0,1,0,0,2484,8,2481,0,733
22707,227,0,543,,Arrendamientos y Derechos Pagados por Anticipado,A,D,N,4,0,1,0,0,2485,5,2476,0,652
22707001,22707,0,54316,,De Bienes Muebles,A,D,N,5,0,1,0,0,2486,8,2485,0,668
22707002,22707,0,54317,,De Bienes Inmuebles,A,D,N,5,0,1,0,0,2487,8,2485,0,669
22707003,22707,0,54318,,De Bienes Intangibles,A,D,N,5,0,1,0,0,2488,8,2485,0,670
22709,227,0,543,,Mantenimiento y Reparación Pagados por Anticipado,A,D,N,4,0,1,0,0,2489,5,2476,0,652
22709001,22709,0,54301,,Mantenimiento y Reparaciones de Bienes Muebles,A,D,N,5,0,2,0,0,2490,8,2489,0,653
22709002,22709,0,54302,,Mantenimiento y Reparaciones de Vehiculos,A,D,N,5,0,2,0,0,2491,8,2489,0,654
22709003,22709,0,54303,,Mantenimiento y Reparaciones de Bienes Inmuebles,A,D,N,5,0,1,0,0,2492,8,2489,0,655
22711,227,0,543,,Servicios Comerciales Pagados por Anticipado,A,D,N,4,0,1,0,0,2493,5,2476,0,652
22711001,22711,0,54304,,"Transportes, Fletes y Almacenamientos",A,D,N,5,0,1,0,0,2494,8,2493,0,656
22711002,22711,0,54305,,Servicios de Publicidad,A,D,N,5,0,1,0,0,2495,8,2493,0,657
22711003,22711,0,54307,,Servicios de Limpiezas y Fumigaciones,A,D,N,5,0,1,0,0,2496,8,2493,0,659
22713,227,0,545,,Servicios Profesionales Pagados por Anticipado,A,D,N,4,0,1,0,0,2497,5,2476,0,678
22713001,22713,0,54501,,Servicios Médicos,A,D,N,5,0,1,0,0,2498,8,2497,0,679
22713002,22713,0,54504,,Servicios de Contabilidad y Auditoría,A,D,N,5,0,1,0,0,2499,8,2497,0,682
22713003,22713,0,54505,,Servicios de Capacitación,A,D,N,5,0,1,0,0,2500,8,2497,0,683
22713004,22713,0,54507,,Desarrollos Informáticos,A,D,N,5,0,1,0,0,2501,8,2497,0,685
22713005,22713,0,54508,,Estudios e Investigaciones,A,D,N,5,0,1,0,0,2502,8,2497,0,686
22713099,22713,0,54599,,"Consultorías, Estudios e Investigaciones Diversas",A,D,N,5,0,1,0,0,2503,8,2497,0,687
22715,227,0,541,,Adquisición de Combustibles y Lubricantes Pagados por Anticipado,A,D,N,4,0,1,0,0,2504,5,2476,0,623
22715001,22715,0,54110,,"Combusti. y Lubrican. por Cupones, Recargo Elect. a Tarjetas de Consumo y Otros",A,D,N,5,0,1,0,0,2505,8,2504,0,633
22716,227,0,541,,Adquisición de Bienes Pagados por Anticipado,A,D,N,4,0,1,0,0,2506,5,2476,0,623
22716001,22716,0,54101,,Bienes Adquiridos por Tarjetas Prepago y Otros,A,D,N,5,0,1,0,0,2507,8,2506,0,624
22717,227,0,0,,Derechos por Servicios Diversos a Proyectos de Inversión,A,D,N,4,0,0,0,0,2508,5,2476,0,0
22717001,22717,0,0,,Derechos por Servicios Diversos a Proyectos de Inversión,A,D,N,5,0,0,0,0,2509,8,2508,0,0
22719,227,0,0,,Descuentos en Ventas de Títulosvalores,A,D,N,4,0,0,0,0,2510,5,2476,0,0
22719001,22719,0,0,,Descuentos en Ventas de Títulosvalores,A,D,N,5,0,0,0,0,2511,8,2510,0,0
22721,227,0,0,,Cargos por Devolución de Impuestos Pagados en Exceso,A,D,N,4,0,0,0,0,2512,5,2476,0,0
22721001,22721,0,0,,Cargos por Devolución de Impuestos Pagados en Exceso,A,D,N,5,0,0,0,0,2513,8,2512,0,0
22723,227,0,0,,Cargos por Convenios en Subsidios,A,D,N,4,0,0,0,0,2514,5,2476,0,0
22723001,22723,0,0,,Notas de Crédito del Tesoro Público,A,D,N,5,0,0,0,0,2515,8,2514,0,0
22724,227,0,0,,Cargos por Convenios de Obligaciones,A,D,N,4,0,0,0,0,2516,5,2476,0,0
22724001,22724,0,0,,ANDA Deuda con Distribuidoras de Energía Eléctrica,A,D,N,5,0,0,0,0,2517,8,2516,0,0
22725,227,0,0,,Derechos por Convenios en Subsidios,A,D,N,4,0,0,0,0,2518,5,2476,0,0
22725001,22725,0,0,,Subsidio G.L.P.,A,D,N,5,0,0,0,0,2519,8,2518,0,0
22727,227,0,0,,Cargos Temporales por Reserva Técnica,A,D,N,4,0,0,0,0,2520,5,2476,0,0
22727001,22727,0,0,,Cargos Temporales por Reserva Técnica,A,D,N,5,0,0,0,0,2521,8,2520,0,0
22729,227,0,0,,Cargos por Contribuciones Legales,A,D,N,4,0,0,0,0,2522,5,2476,0,0
22729001,22729,0,0,,Cargos por Contribuciones Legales,A,D,N,5,0,0,0,0,2523,8,2522,0,0
22730,227,0,0,,Derechos por Promociones,A,D,N,4,0,0,0,0,2524,5,2476,0,0
22730001,22730,0,0,,Derechos por Promociones,A,D,N,5,0,0,0,0,2525,8,2524,0,0
22731,227,0,0,,Servicios Pagados por Anticipado,A,D,N,4,0,0,0,0,2526,5,2476,0,0
22731001,22731,0,0,,Servicios Administrativos por Uso de Tarjetas Electrónicas,A,D,N,5,0,0,0,0,2527,8,2526,0,0
22798,227,0,0,,Cargos por Contribuciones Estatales a Instituciones de Seguridad Social,A,D,N,4,0,0,0,0,2528,5,2476,0,0
22798001,22798,0,0,,Cargos por Contribuciones Estatales a Instituciones de Seguridad Social,A,D,N,5,0,0,0,0,2529,8,2528,0,0
22799,227,0,0,,Amortizaciones Acumuladas,A,A,N,4,0,0,0,0,2530,5,2476,0,0
22799001,22799,0,0,,Amortizaciones Acumuladas,A,A,N,5,0,0,0,0,2531,8,2530,0,0
229,22,0,0,,Inversiones no Recuperables,A,D,S,3,0,0,0,0,2532,3,2089,0,0
22901,229,0,0,,Inversiones Financieras en Cobranza Judicial,A,D,S,4,0,0,0,0,2533,5,2532,0,0
22901001,22901,0,0,,Inversiones Financieras en Cobranza Judicial,A,D,N,5,0,0,0,0,2534,8,2533,0,0
22903,229,0,0,,Inversiones Temporales no Recuperables,A,D,S,4,0,0,0,0,2535,5,2532,0,0
22903001,22903,0,0,,Inversiones Temporales no Recuperables,A,D,N,5,0,0,0,0,2536,8,2535,0,0
22905,229,0,0,,Inversiones Permanentes no Recuperables,A,D,S,4,0,0,0,0,2537,5,2532,0,0
22905001,22905,0,0,,Inversiones Permanentes no Recuperables,A,D,N,5,0,0,0,0,2538,8,2537,0,0
22907,229,0,0,,Inversiones en Préstamos no Recuperables,A,D,S,4,0,0,0,0,2539,5,2532,0,0
22907001,22907,0,0,,Inversiones en Préstamos no Recuperables,A,D,N,5,0,0,0,0,2540,8,2539,0,0
22909,229,0,0,,Deudores Financieros no Recuperables,A,D,S,4,0,0,0,0,2541,5,2532,0,0
22909001,22909,0,0,,Deudores Financieros no Recuperables,A,D,N,5,0,0,0,0,2542,8,2541,0,0
22999,229,0,0,,Estimaciones Inversiones no Recuperables,A,A,S,4,0,0,0,0,2543,5,2532,0,0
22999001,22999,0,0,,Estimaciones Inversiones no Recuperables,A,A,N,5,0,0,0,0,2544,8,2543,0,0
23,2,0,0,,Inversiones en Existencias,A,D,S,2,0,0,0,0,2545,2,1,0,0
231,23,0,0,,Existencias Institucionales,A,D,S,3,0,0,0,0,2546,3,2545,0,0
23101,231,0,541,,Productos Alimenticios Agropecuarios y Forestales,A,D,S,4,0,1,0,0,2547,5,2546,0,623
23101001,23101,0,54101,,Productos Alimenticios para Personas,A,D,N,5,0,1,0,0,2548,8,2547,0,624
23101002,23101,0,54102,,Productos Alimenticios para Animales,A,D,N,5,0,1,0,0,2549,8,2547,0,625
23101003,23101,0,54103,,Productos Agropecuarios y Forestales,A,D,N,5,0,1,0,0,2550,8,2547,0,626
23103,231,0,541,,Productos Textiles y Vestuarios,A,D,S,4,0,1,0,0,2551,5,2546,0,623
23103001,23103,0,54104,,Productos Textiles y Vestuarios,A,D,N,5,0,1,0,0,2552,8,2551,0,627
23105,231,0,541,,"Materiales de  Oficina, Productos de Papel e Impresos",A,D,S,4,0,1,0,0,2553,5,2546,0,623
23105001,23105,0,54105,,Productos de Papel y Cartón,A,D,N,5,0,1,0,0,2554,8,2553,0,628
23105002,23105,0,54114,,Materiales de Oficina,A,D,N,5,0,1,0,0,2555,8,2553,0,637
23105003,23105,0,54116,,"Libros, Textos, Utiles de Enseñanza y Publicaciones",A,D,N,5,0,1,0,0,2556,8,2553,0,639
23107,231,0,541,,Productos de Cuero y Caucho,A,D,S,4,0,1,0,0,2557,5,2546,0,623
23107001,23107,0,54106,,Productos de Cuero y Caucho,A,D,N,5,0,1,0,0,2558,8,2557,0,629
23107003,23107,0,54109,,Llantas y Neumáticos,A,D,N,5,0,1,0,0,2559,8,2557,0,632
23109,231,0,541,,"Productos Químicos, Combustibles y Lubricantes",A,D,S,4,0,1,0,0,2560,5,2546,0,623
23109001,23109,0,54107,,Productos Químicos,A,D,N,5,0,1,0,0,2561,8,2560,0,630
23109002,23109,0,54108,,Productos Farmacéuticos y Medicinales,A,D,N,5,0,1,0,0,2562,8,2560,0,631
23109003,23109,0,54110,,Combustibles y Lubricantes,A,D,N,5,0,1,0,0,2563,8,2560,0,633
23109004,23109,0,54122,,Vacuna para Personas,A,D,N,5,0,1,0,0,2564,8,2560,0,644
23109005,23109,0,54123,,Oxígeno,A,D,N,5,0,1,0,0,2565,8,2560,0,645
23111,231,0,541,,Minerales y Productos Derivados,A,D,S,4,0,1,0,0,2566,5,2546,0,623
23111001,23111,0,54111,,Minerales no Metálicos y Productos Derivados,A,D,N,5,0,1,0,0,2567,8,2566,0,634
23111002,23111,0,54112,,Minerales Metálicos y Productos Derivados,A,D,N,5,0,1,0,0,2568,8,2566,0,635
23113,231,0,541,,Materiales de Uso o Consumo,A,D,S,4,0,1,0,0,2569,5,2546,0,623
23113001,23113,0,54113,,Materiales e Instrumental de Laboratorios y Uso Médico,A,D,N,5,0,1,0,0,2570,8,2569,0,636
23113002,23113,0,54115,,Materiales Informáticos,A,D,N,5,0,1,0,0,2571,8,2569,0,638
23113003,23113,0,54117,,Materiales de Defensa y Seguridad Pública,A,D,N,5,0,1,0,0,2572,8,2569,0,640
23113004,23113,0,54119,,Materiales Eléctricos,A,D,N,5,0,1,0,0,2573,8,2569,0,642
23115,231,0,541,,Bienes de Uso y Consumo Diversos,A,D,S,4,0,1,0,0,2574,5,2546,0,623
23115001,23115,0,54118,,"Herramientas, Repuestos y Accesorios",A,D,N,5,0,1,0,0,2575,8,2574,0,641
23115099,23115,0,54199,,Bienes de Uso y Consumo Diversos,A,D,N,5,0,1,0,0,2576,8,2574,0,646
23117,231,0,611,,"Maquinaria, Equipo y Mobiliario Diverso",A,D,S,4,0,1,0,0,2577,5,2546,0,757
23117001,23117,0,61101,,Mobiliarios,A,D,N,5,0,1,0,0,2578,8,2577,0,758
23117002,23117,0,61102,,Maquinarias y Equipos,A,D,N,5,0,1,0,0,2579,8,2577,0,759
23117003,23117,0,61103,,Equipos Médicos y de Laboratorios,A,D,N,5,0,1,0,0,2580,8,2577,0,760
23117004,23117,0,61104,,Equipos Informáticos,A,D,N,5,0,1,0,0,2581,8,2577,0,761
23117005,23117,0,61108,,Herramientas y Repuestos Principales,A,D,N,5,0,1,0,0,2582,8,2577,0,765
23117006,23117,0,61110,,Maquinaria y Equipo para Apoyo Institucional,A,D,N,5,0,1,0,0,2583,8,2577,0,767
23117099,23117,0,61199,,Bienes Muebles Diversos,A,D,N,5,0,1,0,0,2584,8,2577,0,768
23121,231,0,612,,Inmueble para la Venta,A,D,S,4,0,1,0,0,2585,5,2546,0,769
23121001,23121,0,61201,,Terrenos,A,D,N,5,0,1,0,0,2586,8,2585,0,770
23121002,23121,0,61202,,Edificios e Instalaciones,A,D,N,5,0,1,0,0,2587,8,2585,0,771
23121099,23121,0,61299,,Inmuebles Diversos,A,D,N,5,0,1,0,0,2588,8,2585,0,772
23123,231,0,541,,Especies Municipales,A,D,N,4,0,1,0,0,2589,5,2546,0,623
23123001,23123,0,54121,,Especies Municipales Diversas,A,D,N,5,0,1,0,0,2590,8,2589,0,643
23125,231,0,613,,Semovientes,A,D,N,4,0,1,0,0,2591,5,2546,0,773
23125001,23125,0,61301,,Ganado Vacuno,A,D,N,5,0,1,0,0,2592,8,2591,0,774
23125002,23125,0,61302,,Ganado Caballar,A,D,N,5,0,1,0,0,2593,8,2591,0,775
23125003,23125,0,61303,,Ganado Porcino,A,D,N,5,0,1,0,0,2594,8,2591,0,776
23125099,23125,0,61399,,Semovientes Diversos,A,D,N,5,0,1,0,0,2595,8,2591,0,777
23127,231,0,0,,Bienes y Mercaderìas Entregadas en Consignaciòn,A,D,N,4,0,0,0,0,2596,5,2546,0,0
23127001,23127,0,0,,Bienes y Mercaderìas Entregadas en Consignaciòn,A,D,N,5,0,0,0,0,2597,8,2596,0,0
23129,231,0,543,,Servicios Comerciales,A,D,N,4,0,1,0,0,2598,5,2546,0,652
23129001,23129,0,54313,,"Impresiones, Publicaciones, Reproducciones y Especies Valoradas",A,D,N,5,0,1,0,0,2599,8,2598,0,665
23141,231,0,0,,Productos en Proceso,A,D,S,4,0,0,0,0,2600,5,2546,0,0
23141001,23141,0,0,,Productos en Proceso,A,D,N,5,0,0,0,0,2601,8,2600,0,0
23143,231,0,0,,Productos Terminados,A,D,S,4,0,0,0,0,2602,5,2546,0,0
23143001,23143,0,0,,Productos Terminados,A,D,N,5,0,0,0,0,2603,8,2602,0,0
23195,231,0,0,,Desechos y Residuos,A,D,S,4,0,0,0,0,2604,5,2546,0,0
23195001,23195,0,0,,Desechos y Residuos,A,D,N,5,0,0,0,0,2605,8,2604,0,0
23196,231,0,0,,Activos Extraordinarios,A,D,N,4,0,0,0,0,2606,5,2546,0,0
23196001,23196,0,0,,Activos Extraordinarios,A,D,N,5,0,0,0,0,2607,8,2606,0,0
23198,231,0,0,,Existencias por Liquidar,A,D,S,4,0,0,0,0,2608,5,2546,0,0
23198001,23198,0,0,,Existencias por Liquidar,A,D,N,5,0,0,0,0,2609,8,2608,0,0
23199,231,0,0,,"Provisión por Perdida, Obsolescencia, Mermas y Deteriodos",A,A,S,4,0,0,0,0,2610,5,2546,0,0
23199001,23199,0,0,,"Provisión por Perdida, Obsolescencia, Mermas y Deteriodos",A,A,N,5,0,0,0,0,2611,8,2610,0,0
232,23,0,0,,Existencia de Bienes en Extinción de Dominio,A,D,S,3,0,0,0,0,2612,3,2545,0,0
23201,232,0,541,,"Productos Alimenticios, Agropecuarios y Forestales",A,D,S,4,0,1,0,0,2613,5,2612,0,623
23201001,23201,0,54101,,Productos Alimenticios para Personas,A,D,N,5,0,1,0,0,2614,8,2613,0,624
23201002,23201,0,54102,,Productos Alimenticios para Animales,A,D,N,5,0,1,0,0,2615,8,2613,0,625
23201003,23201,0,54103,,Productos Agropecuarios y Forestales,A,D,N,5,0,1,0,0,2616,8,2613,0,626
23203,232,0,541,,Productos Textiles y Vestuarios,A,D,S,4,0,1,0,0,2617,5,2612,0,623
23203001,23203,0,54104,,Productos Textiles y Vestuarios,A,D,N,5,0,1,0,0,2618,8,2617,0,627
23205,232,0,541,,"Materiales de Oficina, Productos de Papel e Impresos",A,D,N,4,0,1,0,0,2619,5,2612,0,623
23205001,23205,0,54105,,Productos de Papel y Cartón,A,D,N,5,0,1,0,0,2620,8,2619,0,628
23205002,23205,0,54114,,Materiales de Oficina,A,D,N,5,0,1,0,0,2621,8,2619,0,637
23205003,23205,0,54116,,"Libros, Textos, Útiles de Enseñanza y Publicaciones",A,D,N,5,0,1,0,0,2622,8,2619,0,639
23207,232,0,541,,Productos de Cuero y Caucho,A,D,N,4,0,1,0,0,2623,5,2612,0,623
23207001,23207,0,54106,,Productos de Cuero y Caucho,A,D,N,5,0,1,0,0,2624,8,2623,0,629
23207003,23207,0,54109,,Llantas y Neumáticos,A,D,N,5,0,1,0,0,2625,8,2623,0,632
23209,232,0,541,,"Productos Químicos, Combustibles y Lubricantes",A,D,N,4,0,1,0,0,2626,5,2612,0,623
23209001,23209,0,54107,,Productos Químicos ,A,D,N,5,0,1,0,0,2627,8,2626,0,630
23209002,23209,0,54108,,Productos Farmacéuticos y Medicinales,A,D,N,5,0,1,0,0,2628,8,2626,0,631
23209003,23209,0,54110,,Conbustibles y Lubricantes,A,D,N,5,0,1,0,0,2629,8,2626,0,633
23209004,23209,0,54122,,Vacunas para Personas,A,D,N,5,0,1,0,0,2630,8,2626,0,644
23209005,23209,0,54123,,Oxígeno,A,D,N,5,0,1,0,0,2631,8,2626,0,645
23211,232,0,541,,Minerales y Productos Derivados,A,D,N,4,0,1,0,0,2632,5,2612,0,623
23211001,23211,0,54111,,Minerales no Metálicos y Productos Derivados,A,D,N,5,0,1,0,0,2633,8,2632,0,634
23211002,23211,0,54112,,Minerales Metálicos y Productos Derivados,A,D,N,5,0,1,0,0,2634,8,2632,0,635
23213,232,0,541,,Materiales de Uso y Consumo,A,D,N,4,0,1,0,0,2635,5,2612,0,623
23213001,23213,0,54113,,Materiales e Insumos de Laboratorio y Uso Médico,A,D,N,5,0,1,0,0,2636,8,2635,0,636
23213002,23213,0,54115,,Materiales Informáticos ,A,D,N,5,0,1,0,0,2637,8,2635,0,638
23213003,23213,0,54117,,Materiales de Defensa y Seguridad Pública,A,D,N,5,0,1,0,0,2638,8,2635,0,640
23213004,23213,0,54119,,Materiales Elécticos,A,D,N,5,0,1,0,0,2639,8,2635,0,642
23215,232,0,541,,Bienes de Uso y Consumo Diverso,A,D,N,4,0,1,0,0,2640,5,2612,0,623
23215001,23215,0,54118,,"Herramientas, Repuestos y Accesorios",A,D,N,5,0,1,0,0,2641,8,2640,0,641
23215099,23215,0,54199,,Bienes de Uso y Consumo Diverso,A,D,N,5,0,1,0,0,2642,8,2640,0,646
23217,232,0,611,,"Maquinaria, Equipo y Mobiliario Diverso",A,D,N,4,0,1,0,0,2643,5,2612,0,757
23217001,23217,0,61101,,Mobiliarios,A,D,N,5,0,1,0,0,2644,8,2643,0,758
23217002,23217,0,61102,,Maquinarias y Equipos,A,D,N,5,0,1,0,0,2645,8,2643,0,759
23217003,23217,0,61110,,Maquinaria y Equipo de Apoyo Institucional,A,D,N,5,0,1,0,0,2646,8,2643,0,767
23217004,23217,0,61104,,Equipos Informáticos,A,D,N,5,0,1,0,0,2647,8,2643,0,761
23217005,23217,0,61108,,Herramientas y Repuestos Principales,A,D,N,5,0,1,0,0,2648,8,2643,0,765
23217099,23217,0,61199,,Bienes Muebles Diversos,A,D,N,5,0,1,0,0,2649,8,2643,0,768
23218,232,0,611,,Maquinaria y Equipo de Producción,A,D,N,4,0,1,0,0,2650,5,2612,0,757
23218001,23218,0,61109,,Maquinarias y Equipos de Producción,A,D,N,5,0,1,0,0,2651,8,2650,0,766
23219,232,0,611,,Equipos Médicos y de Laboratorios,A,D,N,4,0,1,0,0,2652,5,2612,0,757
23219001,23219,0,61103,,Equipos Médicos y de Laboratorios,A,D,N,5,0,1,0,0,2653,8,2652,0,760
23220,232,0,611,,"Equipo de Transporte, Tracción y Elevación",A,D,N,4,0,1,0,0,2654,5,2612,0,757
23220001,23220,0,61105,,Vehículos de Transporte,A,D,N,5,0,1,0,0,2655,8,2654,0,762
23221,232,0,612,,Bienes Inmuebles,A,D,N,4,0,1,0,0,2656,5,2612,0,769
23221001,23221,0,61201,,Terrenos,A,D,N,5,0,1,0,0,2657,8,2656,0,770
23221002,23221,0,61202,,Edificios e Instalaciones,A,D,N,5,0,1,0,0,2658,8,2656,0,771
23221099,23221,0,61299,,Inmuebles Diversos,A,D,N,5,0,1,0,0,2659,8,2656,0,772
23223,232,0,611,,"Obras de Arte, Libros y Colecciones",A,D,N,4,0,1,0,0,2660,5,2612,0,757
23223001,23223,0,61106,,Obras de Arte y Culturales,A,D,N,5,0,1,0,0,2661,8,2660,0,763
23223002,23223,0,61107,,Libros y Colecciones,A,D,N,5,0,1,0,0,2662,8,2660,0,764
23225,232,0,613,,Semovientes,A,D,N,4,0,1,0,0,2663,5,2612,0,773
23225001,23225,0,61301,,Ganado Vacuno,A,D,N,5,0,1,0,0,2664,8,2663,0,774
23225002,23225,0,61302,,Ganado Caballar,A,D,N,5,0,1,0,0,2665,8,2663,0,775
23225003,23225,0,61303,,Ganado Porcino,A,D,N,5,0,1,0,0,2666,8,2663,0,776
23225099,23225,0,61399,,Semovientes Diversos,A,D,N,5,0,1,0,0,2667,8,2663,0,777
23227,232,0,541,,Equipo de Defensa y Seguridad Pública,A,D,N,4,0,1,0,0,2668,5,2612,0,623
23227001,23227,0,54117,,Equipo de Defensa y Seguridad Pública,A,D,N,5,0,1,0,0,2669,8,2668,0,640
23299,232,0,0,,"Provisión por Pérdida, Obsolescencia, Mermas y Deterioro",A,D,N,4,0,0,0,0,2670,5,2612,0,0
233,23,0,0,,Existencias de Producción en Proceso,A,D,S,3,0,0,0,0,2671,3,2545,0,0
23301,233,0,511,,Remuneraciones Personal Permanente,A,D,S,4,0,1,0,0,2672,5,2671,0,571
23301001,23301,0,51101,,Sueldos,A,D,N,5,0,1,0,0,2673,8,2672,0,572
23301002,23301,0,51102,,Salarios por Jornal,A,D,N,5,0,1,0,0,2674,8,2672,0,573
23301003,23301,0,51103,,Aguinaldos,A,D,N,5,0,1,0,0,2675,8,2672,0,574
23301004,23301,0,51104,,Sobresueldos,A,D,N,5,0,1,0,0,2676,8,2672,0,575
23301005,23301,0,51105,,Dietas,A,D,N,5,0,1,0,0,2677,8,2672,0,576
23301006,23301,0,51106,,Complementos,A,D,N,5,0,1,0,0,2678,8,2672,0,577
23301007,23301,0,51107,,Beneficios Adicionales,A,D,N,5,0,1,0,0,2679,8,2672,0,578
23303,233,0,512,,Remuneraciones al Personal Eventual,A,D,S,4,0,1,0,0,2680,5,2671,0,579
23303001,23303,0,51201,,Sueldos,A,D,N,5,0,1,0,0,2681,8,2680,0,580
23303002,23303,0,51202,,Salarios por Jornal,A,D,N,5,0,1,0,0,2682,8,2680,0,581
23303003,23303,0,51203,,Aguinaldos,A,D,N,5,0,1,0,0,2683,8,2680,0,582
23303004,23303,0,51204,,Sobresueldos,A,D,N,5,0,1,0,0,2684,8,2680,0,583
23303005,23303,0,51206,,Complementos,A,D,N,5,0,1,0,0,2685,8,2680,0,584
23303006,23303,0,51207,,Beneficios Adicionales,A,D,N,5,0,1,0,0,2686,8,2680,0,585
23305,233,0,513,,Remuneraciones por Servicios Extraordinarios,A,D,S,4,0,1,0,0,2687,5,2671,0,586
23305001,23305,0,51301,,Horas Extraordinarias,A,D,N,5,0,1,0,0,2688,8,2687,0,587
23305002,23305,0,51302,,Beneficios Extraordinarios,A,D,N,5,0,1,0,0,2689,8,2687,0,588
23307,233,0,514,,Contribuciones Patronales a Instituciones de Seguridad Social Públicas,A,D,S,4,0,1,0,0,2690,5,2671,0,589
23307001,23307,0,51401,,Por Remuneraciones Permanentes,A,D,N,5,0,1,0,0,2691,8,2690,0,590
23307002,23307,0,51402,,Por Remuneraciones Eventuales,A,D,N,5,0,1,0,0,2692,8,2690,0,591
23307003,23307,0,51403,,Por Remuneraciones Extraordinarias,A,D,N,5,0,1,0,0,2693,8,2690,0,592
23309,233,0,515,,Contribuciones Patronales a Instit.  de Seguridad Social Privadas,A,D,S,4,0,1,0,0,2694,5,2671,0,593
23309001,23309,0,51501,,Por Remuneraciones Permanentes,A,D,N,5,0,1,0,0,2695,8,2694,0,594
23309002,23309,0,51502,,Por Remuneraciones Eventuales,A,D,N,5,0,1,0,0,2696,8,2694,0,595
23309003,23309,0,51503,,Por Remuneraciones Extraordinarias,A,D,N,5,0,1,0,0,2697,8,2694,0,596
23311,233,0,516,,Gastos de Representación,A,D,S,4,0,1,0,0,2698,5,2671,0,597
23311001,23311,0,51601,,Por Prestación de Servicios en el País,A,D,N,5,0,1,0,0,2699,8,2698,0,598
23311002,23311,0,51602,,Por Prestación de Servicios en el Exterior,A,D,N,5,0,1,0,0,2700,8,2698,0,599
23313,233,0,517,,Indemnizaciones,A,D,S,4,0,1,0,0,2701,5,2671,0,600
23313001,23313,0,51701,,Al Personal de Servicios Permanentes,A,D,N,5,0,1,0,0,2702,8,2701,0,601
23313002,23313,0,51702,,Al Personal de Servicios Eventuales,A,D,N,5,0,1,0,0,2703,8,2701,0,602
23315,233,0,519,,Otras Remuneraciones,A,D,S,4,0,1,0,0,2704,5,2671,0,608
23315001,23315,0,51901,,Honorarios,A,D,N,5,0,1,0,0,2705,8,2704,0,609
23315002,23315,0,51902,,Remuneraciones por Servicios Especiales,A,D,N,5,0,1,0,0,2706,8,2704,0,610
23315003,23315,0,51903,,Prestaciones Sociales al Personal,A,D,N,5,0,1,0,0,2707,8,2704,0,611
23315099,23315,0,51999,,Remuneraciones Diversas,A,D,N,5,0,1,0,0,2708,8,2704,0,612
23317,233,0,541,,Productos Alimenticios Agropecuarios y Forestales,A,D,S,4,0,1,0,0,2709,5,2671,0,623
23317001,23317,0,54101,,Productos Alimenticios para Personas,A,D,N,5,0,1,0,0,2710,8,2709,0,624
23317002,23317,0,54102,,Productos Alimenticios para Animales,A,D,N,5,0,1,0,0,2711,8,2709,0,625
23317003,23317,0,54103,,Productos Agropecuarios y Forestales,A,D,N,5,0,1,0,0,2712,8,2709,0,626
23319,233,0,541,,Productos Textiles y Vestuarios,A,D,S,4,0,1,0,0,2713,5,2671,0,623
23319001,23319,0,54104,,Productos Textiles y Vestuarios,A,D,N,5,0,1,0,0,2714,8,2713,0,627
23321,233,0,541,,"Materiales de Oficina, Productos de Papel e Impresos",A,D,S,4,0,1,0,0,2715,5,2671,0,623
23321001,23321,0,54105,,Productos de Papel y Cartón,A,D,N,5,0,1,0,0,2716,8,2715,0,628
23321002,23321,0,54114,,Materiales de Oficina,A,D,N,5,0,1,0,0,2717,8,2715,0,637
23321003,23321,0,54116,,"LIbros, Textos, Utiles de Enseñanza y Publicaciones",A,D,N,5,0,1,0,0,2718,8,2715,0,639
23323,233,0,541,,Productos de Cuero y Caucho,A,D,S,4,0,1,0,0,2719,5,2671,0,623
23323001,23323,0,54106,,Productos de Cuero y Caucho,A,D,N,5,0,1,0,0,2720,8,2719,0,629
23323003,23323,0,54109,,Llantas y Neumáticos,A,D,N,5,0,1,0,0,2721,8,2719,0,632
23325,233,0,541,,"Productos Químicos, Combustibles y Lubricantes",A,D,S,4,0,1,0,0,2722,5,2671,0,623
23325001,23325,0,54107,,Productos Químicos,A,D,N,5,0,1,0,0,2723,8,2722,0,630
23325002,23325,0,54108,,Productos Farmacéuticos y Medicinales,A,D,N,5,0,1,0,0,2724,8,2722,0,631
23325003,23325,0,54110,,Combustibles y Lubricantes,A,D,N,5,0,1,0,0,2725,8,2722,0,633
23327,233,0,541,,Minerales y Productos Derivados,A,D,S,4,0,1,0,0,2726,5,2671,0,623
23327001,23327,0,54111,,Minerales no Metálicos y Productos Derivados,A,D,N,5,0,1,0,0,2727,8,2726,0,634
23327002,23327,0,54112,,MInerales Métalicos y Productos Derivados,A,D,N,5,0,1,0,0,2728,8,2726,0,635
23329,233,0,541,,Materiales de Uso o Consumo,A,D,S,4,0,1,0,0,2729,5,2671,0,623
23329001,23329,0,54113,,Materiales e Instrumental de Laboratorios y Uso Médico,A,D,N,5,0,1,0,0,2730,8,2729,0,636
23329002,23329,0,54115,,Materiales Informáticos,A,D,N,5,0,1,0,0,2731,8,2729,0,638
23329003,23329,0,54117,,Materiales de Defensa y Seguridad Pública,A,D,N,5,0,1,0,0,2732,8,2729,0,640
23329004,23329,0,54119,,Materiales Eléctricos,A,D,N,5,0,1,0,0,2733,8,2729,0,642
23331,233,0,541,,Bienes de Uso y Consumo Diversos,A,D,S,4,0,1,0,0,2734,5,2671,0,623
23331001,23331,0,54118,,"Herramientas, Repuestos y Accesorios",A,D,N,5,0,1,0,0,2735,8,2734,0,641
23331099,23331,0,54199,,Bienes de Uso y Consumo Diversos,A,D,N,5,0,1,0,0,2736,8,2734,0,646
23333,233,0,542,,Servicios Básicos,A,D,S,4,0,1,0,0,2737,5,2671,0,647
23333001,23333,0,54201,,Servicios de Energía Eléctrica,A,D,N,5,0,1,0,0,2738,8,2737,0,648
23333002,23333,0,54202,,Servicios de Agua,A,D,N,5,0,1,0,0,2739,8,2737,0,649
23333003,23333,0,54203,,Servicios de Telecomunicaciones,A,D,N,5,0,1,0,0,2740,8,2737,0,650
23333004,23333,0,54204,,Servicios de Correos,A,D,N,5,0,1,0,0,2741,8,2737,0,651
23335,233,0,543,,Mantenimiento y Reparación,A,D,S,4,0,1,0,0,2742,5,2671,0,652
23335001,23335,0,54301,,Mantenimiento y Reparaciones de Bienes Muebles,A,D,N,5,0,1,0,0,2743,8,2742,0,653
23335002,23335,0,54302,,Mantenimiento y Reparaciones de Vehículos,A,D,N,5,0,1,0,0,2744,8,2742,0,654
