code,parent_code,budget_income,budget_expense,COD_INS_CAR_TRA,NOMB_CTA_CONT_CENT,TIPO_CUEN_CONT,NATURA_SALDO,TIENE_SUBCTA,NIVEL,TIPO_EJEC_PTO_INGR,TIPO_EJEC_PTO_EGRE,TIP_FLU_FDO_DEB,TIP_FLU_FDO_HAB,id_temporal,longitud,parent_id,budget_income_id_temporal,budget_expense_id_temporal
42456001,42456,0,0,,"Productos Alimenticios, Agropecuarios y Forestales",P,A,N,5,0,0,0,0,7598,8,7597,0,0
42456002,42456,0,0,,Productos Textiles y Vestuarios,P,A,N,5,0,0,0,0,7599,8,7597,0,0
42456003,42456,0,0,,"Materiales de Oficina, Productos de Papel e Impresos",P,A,N,5,0,0,0,0,7600,8,7597,0,0
42456004,42456,0,0,,Productos de Cuero y Caucho,P,A,N,5,0,0,0,0,7601,8,7597,0,0
42456005,42456,0,0,,"Productos Químicos, Combustibles y Lubricantes",P,A,N,5,0,0,0,0,7602,8,7597,0,0
42456006,42456,0,0,,Minerales y Productos Derivados,P,A,N,5,0,0,0,0,7603,8,7597,0,0
42456007,42456,0,0,,Materiales de Uso y Consumo,P,A,N,5,0,0,0,0,7604,8,7597,0,0
42456008,42456,0,0,,Bienes de Uso y Consumo Diverso,P,A,N,5,0,0,0,0,7605,8,7597,0,0
42456009,42456,0,0,,"Maquinaria , Equipo y Movilario Diverso",P,A,N,5,0,0,0,0,7606,8,7597,0,0
42456010,42456,0,0,,Maquinaria y Equipo de Producción,P,A,N,5,0,0,0,0,7607,8,7597,0,0
42456011,42456,0,0,,Equipos Médicos y de Laboratorios,P,A,N,5,0,0,0,0,7608,8,7597,0,0
42456012,42456,0,0,,"Equipo de Transporte, Tracción y Elevación",P,A,N,5,0,0,0,0,7609,8,7597,0,0
42456013,42456,0,0,,Bienes Inmuebles,P,A,N,5,0,0,0,0,7610,8,7597,0,0
42456014,42456,0,0,,"Obras de Arte, Libros y Colecciones",P,A,N,5,0,0,0,0,7611,8,7597,0,0
42456015,42456,0,0,,Semovientes,P,A,N,5,0,0,0,0,7612,8,7597,0,0
42456016,42456,0,0,,Equipo de Defensa y Seguridad Pública,P,A,N,5,0,0,0,0,7613,8,7597,0,0
42457,424,0,0,,Asignación por Derechos Especiales de Giro-GOES,P,A,N,4,0,0,0,0,7614,5,7503,0,0
42457001,42457,0,0,,DEG-Gobierno de El Salvador,P,A,N,5,0,0,0,0,7615,8,7614,0,0
42459,424,0,0,,Préstamos Temporales,P,A,N,4,0,0,0,0,7616,5,7503,0,0
42459001,42459,0,0,,De Empresas Privadas Financieras,P,A,N,5,0,0,0,0,7617,8,7616,0,0
42459005,42459,0,0,,De Instituciones de Seguridad Social,P,A,N,5,0,0,0,0,7618,8,7616,0,0
42460,424,0,0,,Provisión por Promociones,P,A,N,4,0,0,0,0,7619,5,7503,0,0
42460001,42460,0,0,,Provisión por Promociones ,P,A,N,5,0,0,0,0,7620,8,7619,0,0
42461,424,0,0,,Inversiones en Acciones Susctiras y no Pagadas,P,A,N,4,0,0,0,0,7621,5,7503,0,0
42461001,42461,0,0,,Inversiones en Acciones Susctiras y no Pagadas,P,A,N,5,0,0,0,0,7622,8,7621,0,0
42463,424,0,0,,Redención Anticipada de Títulosvalores,P,A,N,4,0,0,0,0,7623,5,7503,0,0
42463001,42463,0,0,,Redención Anticipada de Títulosvalores,P,A,N,5,0,0,0,0,7624,8,7623,0,0
42498,424,0,0,,Provisión para Financiamiento de Terceros por Aplicar,P,A,S,4,0,0,0,0,7625,5,7503,0,0
42498001,42498,0,0,,Provisión para Financiamiento de Terceros por Aplicar,P,A,N,5,0,0,0,0,7626,8,7625,0,0
425,42,0,0,,Endeudamiento Interno a Largo Plazo,P,A,N,3,0,0,0,0,7627,3,7381,0,0
42501,425,311,711,,Titulosvalores en el Mercado Nacional,P,A,N,4,2,1,0,0,7628,5,7627,527,835
42501001,42501,31101,71101,,Bonos del Estado,P,A,S,5,2,1,0,0,7629,8,7628,528,836
42501003,42501,31103,71103,,Notas de Crédito Tesoro Público,P,A,N,5,2,1,0,0,7630,8,7628,530,838
42501099,42501,31199,71199,,Titulosvalores Diversos,P,A,N,5,2,1,0,0,7631,8,7628,531,839
42503,425,311,711,,Letras del Tesoro Público,P,A,N,4,2,1,0,0,7632,5,7627,527,835
42503001,42503,0,0,,Letras del Tesoro Público,P,A,N,5,2,1,0,0,7633,8,7632,0,0
42503071,42503,0,0,,Rescate de Letras del Tesoro,P,A,N,5,2,1,0,0,7634,8,7632,0,0
42504,425,0,0,,Certificados del Tesoro,P,A,N,4,2,1,0,0,7635,5,7627,0,0
42504001,42504,0,0,,Certificados del Tesoro,P,A,N,5,2,1,0,0,7636,8,7635,0,0
42505,425,313,713,,Emprestitos del Gobierno Central,P,A,N,4,2,1,0,0,7637,5,7627,536,844
42505001,42505,31301,71301,,Emprestitos del Gobierno Central,P,A,N,5,2,1,0,0,7638,8,7637,537,845
42505825,42505,31301,71301,700.0,Ministerio de Hacienda,P,A,N,5,2,1,0,0,7639,8,7637,537,845
42505853,42505,31301,71301,3200.0,Ministerio de Salud Pública y Asistencia Social,P,A,N,5,2,1,0,0,7640,8,7637,537,845
42505855,42505,31301,71301,3202.0,"Hospital Nacional ""Benjamín Bloom""",P,A,N,5,2,1,0,0,7641,8,7637,537,845
42505868,42505,31301,71301,3215.0,"Hospital Nacional ""Dr. Juan José Fernández"", Zacamil",P,A,N,5,2,1,0,0,7642,8,7637,537,845
42505935,42505,31301,71301,703.0,Tesoro Público (DGT),P,A,N,5,2,1,0,0,7643,8,7637,537,845
42507,425,313,713,,Emprestitos de Instituciones Descentralizadas no Empresariales,P,A,N,4,2,1,0,0,7644,5,7627,536,844
42507001,42507,31302,71302,,Emprestitos de Instituciones Descentralizadas no Empresariales,P,A,N,5,2,1,0,0,7645,8,7644,538,846
42507854,42507,31302,71302,3201.0,Hospital Nacional Rosales,P,A,N,5,2,1,0,0,7646,8,7644,538,846
42507855,42507,31302,71302,3201.0,"Hospital Nacional ""Benjamín Bloom""",P,A,N,5,2,1,0,0,7647,8,7644,538,846
42507857,42507,31302,71302,3204.0,"Hospital Nacional Psiquiatrico ""Dr. José Molina Martínez""",P,A,N,5,2,1,0,0,7648,8,7644,538,846
42507858,42507,31302,71302,3205.0,"Hospital Nacional Neumológico ""Dr. José Antonio Zaldaña""",P,A,N,5,2,1,0,0,7649,8,7644,538,846
42507863,42507,31302,71302,3210.0,"Hospital Nacional ""San Rafael"", Nueva San Salvador",P,A,N,5,2,1,0,0,7650,8,7644,538,846
42507868,42507,31302,71302,3215.0,"Hospital Nacional ""Dr. Juan José Fernández"", Zacamil",P,A,N,5,2,1,0,0,7651,8,7644,538,846
42507876,42507,31302,71302,3223.0,Hospital Nacional de Chalchuapa,P,A,N,5,2,1,0,0,7652,8,7644,538,846
42507878,42507,31302,71302,3225.0,Hospital Nacional San Francisco Gotera,P,A,N,5,2,1,0,0,7653,8,7644,538,846
42507893,42507,31302,71302,3303.0,Instituto Salvadoreño del Seguro Social (ISSS),P,A,N,5,2,1,0,0,7654,8,7644,538,846
42509,425,313,713,,Emprestitos de Empresas Públicas no Financieras,P,A,N,4,2,1,0,0,7655,5,7627,536,844
42509001,42509,31303,71303,,De Empresas Públicas no Financieras,P,A,N,5,2,1,0,0,7656,8,7655,539,847
42511,425,313,713,,Emprestitos de Empresas Públicas Financieras,P,A,N,4,2,1,0,0,7657,5,7627,536,844
42511001,42511,31304,71304,,De Empresas Públicas Financieras,P,A,S,5,2,1,0,0,7658,8,7657,540,848
42513,425,313,713,,Emprestitos de Instituciones de Seguridad Social,P,A,N,4,2,1,0,0,7659,5,7627,536,844
42513001,42513,31305,71305,,De Instituciones de Seguridad Social,P,A,N,5,2,1,0,0,7660,8,7659,541,849
42515,425,313,713,,Emprestitos de Municipalidades,P,A,N,4,2,1,0,0,7661,5,7627,536,844
42515001,42515,31306,71306,,De Municipalidades,P,A,N,5,2,1,0,0,7662,8,7661,542,850
42517,425,313,713,,Emprestitos de Empresas Privadas no Financieras,P,A,N,4,2,1,0,0,7663,5,7627,536,844
42517001,42517,31307,71307,,De Empresas Privadas no Financieras,P,A,N,5,2,1,0,0,7664,8,7663,543,851
42519,425,313,713,,Emprestitos de Empresas Privadas Financieras,P,A,N,4,2,1,0,0,7665,5,7627,536,844
42519001,42519,31308,71308,,De Empresas Privadas Financieras,P,A,N,5,2,1,0,0,7666,8,7665,544,852
42521,425,313,713,,Emprestitos de Organismos Sin Fines de Lucro,P,A,N,4,2,1,0,0,7667,5,7627,536,844
42521001,42521,31309,71309,,De Organismos Sin Fines de Lucro,P,A,N,5,2,1,0,0,7668,8,7667,545,853
42523,425,313,713,,Emprestitos de Personas Naturales,P,A,N,4,2,1,0,0,7669,5,7627,536,844
42523001,42523,31310,71310,,De Personas Naturales,P,A,N,5,2,1,0,0,7670,8,7669,546,854
42551,425,0,0,,Renegociación de Deuda Interna,P,A,N,4,2,1,0,0,7671,5,7627,0,0
42551001,42551,0,0,,Renegociación de Deuda Interna,P,A,N,5,0,0,0,0,7672,8,7671,0,0
42553,425,313,713,,Obligaciones por Operaciones de Titularización,P,A,N,4,2,1,0,0,7673,5,7627,536,844
42553001,42553,31307,71307,,Obligaciones por Operaciones de Titularización,P,A,N,5,2,1,0,0,7674,8,7673,543,851
42598,425,0,0,,Descuento Sobre Venta de Titulosvalores,P,D,N,4,2,1,0,0,7675,5,7627,0,0
42598001,42598,0,0,,Descuento Sobre Venta de Titulosvalores,P,A,N,5,2,1,0,0,7676,8,7675,0,0
426,42,0,0,,Endeudamiento Externo a Largo Plazo,P,A,N,3,0,0,0,0,7677,3,7381,0,0
42601,426,312,712,,Titulosvalores en el Mercado Externo,P,A,N,4,2,1,0,0,7678,5,7677,532,840
42601001,42601,31201,71201,,Bonos del Estado,P,A,N,5,2,1,0,0,7679,8,7678,533,841
42601002,42601,31299,71299,,Derechos Especiales de Giro - Países Extranjeros,P,A,N,5,2,1,0,0,7680,8,7678,535,843
42601099,42601,31299,71299,,Titulosvalores Diversos,P,A,N,5,2,1,0,0,7681,8,7678,535,843
42603,426,312,714,,Letras del Tesoro Público,P,A,N,4,2,1,0,0,7682,5,7677,532,855
42603001,42603,0,0,,Letras del Tesoro Público,P,A,N,5,2,1,0,0,7683,8,7682,0,0
42605,426,314,714,,Emprestitos de Empresas Privadas no Financieras,P,A,N,4,2,1,0,0,7684,5,7677,547,855
42605001,42605,31401,71401,,De Empresas Privadas no Financieras,P,A,N,5,2,1,0,0,7685,8,7684,548,856
42607,426,314,714,,Emprestitos de Empresas Privadas Financieras,P,A,N,4,2,1,0,0,7686,5,7677,547,855
42607001,42607,31402,71402,,De Empresas Privadas Financieras,P,A,N,5,2,1,0,0,7687,8,7686,549,857
42607002,42607,31402,71402,,Banco Santander/equipamiento e instalacion de laboratorio de huellas genéticas,P,A,N,5,2,1,0,0,7688,8,7686,549,857
42607007,42607,31402,71402,,Bancos Franceses,P,A,N,5,2,1,0,0,7689,8,7686,549,857
42607008,42607,31402,71402,,La CAIXA - Caja de Ahorro y Pensiones de Barcelona,P,A,N,5,2,1,0,0,7690,8,7686,549,857
42607036,42607,31402,71402,,BBV - Banco Bilbao Vizcaya,P,A,N,5,2,1,0,0,7691,8,7686,549,857
42607047,42607,31402,71402,,CESCE - Compañia Española de Seguros de Créditos,P,A,N,5,2,1,0,0,7692,8,7686,549,857
42607049,42607,31402,71402,,C.ITOH - Japon,P,A,N,5,2,1,0,0,7693,8,7686,549,857
42607050,42607,31402,71402,,COFACE - Compañia Francesa de Seguros para Comercio Exterior,P,A,N,5,2,1,0,0,7694,8,7686,549,857
42607052,42607,31402,71402,,The Riggs National Bank Of Washington,P,A,N,5,2,1,0,0,7695,8,7686,549,857
42607053,42607,31402,71402,,"PNC BANK, N.A.",P,A,N,5,2,1,0,0,7696,8,7686,549,857
42607056,42607,31402,71402,,Deutsche Bank,P,A,N,5,2,1,0,0,7697,8,7686,549,857
42607058,42607,31402,71402,,TEXTRON FINANCIAL CORPORATION (TFC),P,A,N,5,2,1,0,0,7698,8,7686,549,857
42607059,42607,31402,71402,,Banco Santander Central Hispano,P,A,N,5,2,1,0,0,7699,8,7686,549,857
42607060,42607,31402,71402,,London Forfaiting Commany Ltd.,P,A,N,5,2,1,0,0,7700,8,7686,549,857
42607061,42607,31402,71402,,Banco Nova Scotia,P,A,N,5,2,1,0,0,7701,8,7686,549,857
42609,426,312,714,,Emprestitos de Gobiernos y Organismos Gubernamentales,P,A,N,4,2,1,0,0,7702,5,7677,532,855
42609001,42609,31403,71403,,De Gobiernos y Organismos Gubernamentales,P,A,N,5,2,1,0,0,7703,8,7702,550,858
42609002,42609,31403,71403,,AID - Agencia para el Desarrollo Internacional,P,A,N,5,2,1,0,0,7704,8,7702,550,858
42609003,42609,31403,71403,,"ICO - Instituto de Crédito Oficial, España",P,A,N,5,2,1,0,0,7705,8,7702,550,858
42609004,42609,31403,71403,,Cassa Depositi e Prestiti S.p.A.,P,A,N,5,2,1,0,0,7706,8,7702,550,858
42609005,42609,31403,71403,,Natexis Bank,P,A,N,5,2,1,0,0,7707,8,7702,550,858
42609006,42609,31403,71403,,Eximbank China,P,A,N,5,2,1,0,0,7708,8,7702,550,858
42609007,42609,31403,71403,,Eximbank - Japon,P,A,N,5,2,1,0,0,7709,8,7702,550,858
42609008,42609,31403,71403,,FMS - Foreing Military Sale USA,P,A,N,5,2,1,0,0,7710,8,7702,550,858
42609009,42609,31403,71403,,Credit National,P,A,N,5,2,1,0,0,7711,8,7702,550,858
42609010,42609,31403,71403,,KFW - Kreditanstalt Fur Wiedereufbau,P,A,N,5,2,1,0,0,7712,8,7702,550,858
42609011,42609,31403,71403,,OECF - Fondo de Cooperacion Económica de Ultramar,P,A,N,5,2,1,0,0,7713,8,7702,550,858
42609012,42609,31403,71403,,JBIC-JAPAN BANK FOR INTERNACIONAL COOPERATION,P,A,N,5,2,1,0,0,7714,8,7702,550,858
42609013,42609,31403,71403,,jeximbank-japon,P,A,N,5,2,1,0,0,7715,8,7702,550,858
42609016,42609,31403,71403,,Agencia de Cooperación Internacional del Japón (JICA),P,A,N,5,2,1,0,0,7716,8,7702,550,858
42609036,42609,31403,71403,,BBV-Banco Bilbao Vizcaya,P,A,N,5,2,1,0,0,7717,8,7702,550,858
42609038,42609,31403,71403,,Gobierno de Bélgica,P,A,N,5,2,1,0,0,7718,8,7702,550,858
42609049,42609,31403,71403,,CCC/PL-480 - Commodity Crédit Corporatión,P,A,N,5,2,1,0,0,7719,8,7702,550,858
42609050,42609,31403,71403,,FICD - China,P,A,N,5,2,1,0,0,7720,8,7702,550,858
42609051,42609,31403,71403,,Export Debelopment Canada - EDC,P,A,N,5,2,1,0,0,7721,8,7702,550,858
42609052,42609,31403,71403,,Bpifrance Assurence Export,P,A,N,5,2,1,0,0,7722,8,7702,550,858
42611,426,314,714,,Emprestitos de Organismos Multilaterales,P,A,N,4,2,1,0,0,7723,5,7677,547,855
42611001,42611,31404,71404,,De Organismos Multilaterales,P,A,N,5,2,1,0,0,7724,8,7723,551,859
42611002,42611,31404,71404,,BCIE - Banco Centroamericano de Integración Económica,P,A,N,5,2,1,0,0,7725,8,7723,551,859
42611003,42611,31404,71404,,AIF - Asociación de Fomento Internacional,P,A,N,5,2,1,0,0,7726,8,7723,551,859
42611004,42611,31404,71404,,Fondo de Cooperación Económica de Ultramar-Japón,P,A,N,5,2,1,0,0,7727,8,7723,551,859
42611008,42611,31404,71404,,BID - Banco Interamericano de Desarrollo,P,A,N,5,2,1,0,0,7728,8,7723,551,859
42611009,42611,31404,71404,,BIRF - Banco Internacional de Reconstrucción y Fomento,P,A,N,5,2,1,0,0,7729,8,7723,551,859
42611016,42611,31404,71404,,FIDA - Fondo de Inversión de Desarrollo Agícola,P,A,N,5,2,1,0,0,7730,8,7723,551,859
42611017,42611,31404,71404,,Prestamos Organismos Privados,P,A,N,5,2,1,0,0,7731,8,7723,551,859
42611024,42611,31404,71404,,OPEC - Organización de Países Exportadores de Petroleo,P,A,N,5,2,1,0,0,7732,8,7723,551,859
42611025,42611,31404,71404,,Fondo de la OPEC para el Desarrollo Internacional (OFID),P,A,N,5,2,1,0,0,7733,8,7723,551,859
42611026,42611,31404,71404,,Fondo Monetario Internacional (FMI),P,A,N,5,2,1,0,0,7734,8,7723,551,859
42611027,42611,31404,71404,,Corporación Andina de Fomento,P,A,N,5,2,1,0,0,7735,8,7723,551,859
42613,426,314,714,,Emprestitos de Organismos sin Fines de Lucro,P,A,N,4,2,1,0,0,7736,5,7677,547,855
42613001,42613,31405,71405,,De Organismos sin Fines de Lucro,P,A,N,5,2,1,0,0,7737,8,7736,552,860
42615,426,314,714,,Emprestitos de Personas Naturales,P,A,N,4,2,1,0,0,7738,5,7677,547,855
42615001,42615,31406,71406,,De Personas Naturales,P,A,N,5,2,1,0,0,7739,8,7738,553,861
42651,426,0,0,,Renegociación de Deuda Externa,P,A,N,4,0,0,0,0,7740,5,7677,0,0
42651001,42651,0,0,,Renegociación de Deuda Interna,P,A,N,5,0,0,0,0,7741,8,7740,0,0
42698,426,0,0,,Descuento Sobre Venta de Titulosvalores,P,D,N,4,0,0,0,0,7742,5,7677,0,0
42698001,42698,0,0,,Descuento Sobre Venta de Titulosvalores,P,D,N,5,0,0,0,0,7743,8,7742,0,0
427,42,0,0,,Acreedores Financieros - Largo Plazo,P,A,N,3,0,0,0,0,7744,3,7381,0,0
42701,427,0,555,,Provision para Inscripcion Legal de Documentos,P,A,N,4,0,1,0,0,7745,5,7744,0,717
42701001,42701,0,55504,,Mutuo Hipotecario,P,A,N,5,0,1,0,0,7746,8,7745,0,721
42703,427,163,563,,Depósitos de Afiliados por Contribuciones,P,A,N,4,2,1,0,0,7747,5,7744,301,745
42703001,42703,16301,56301,,De Empresas Privadas no Financieras,P,A,N,5,2,1,0,0,7748,8,7747,302,746
42703002,42703,16302,56302,,De Empresas Privadas Financieras,P,A,N,5,2,1,0,0,7749,8,7747,303,747
42703003,42703,16303,56303,,De Organismos sin Fines de Lucro,P,A,N,5,2,1,0,0,7750,8,7747,304,748
42703004,42703,16304,56304,,De Personas Naturales,P,A,N,5,2,1,0,0,7751,8,7747,305,749
42715,427,0,0,,Acreedores Financieros por Administración de Cartera,P,A,N,4,0,0,0,0,7752,5,7744,0,0
42715001,42715,0,0,,Acreedores Financieros por Administración de Cartera,P,A,N,5,0,0,0,0,7753,8,7752,0,0
42717,427,0,0,,Indemnizaciones Laborales,P,A,N,4,0,0,0,0,7754,5,7744,0,0
42717001,42717,0,0,,Indemnizaciones Laborales,P,A,N,5,0,0,0,0,7755,8,7754,0,0
42719,427,0,0,,Provisiones para Prestaciones Laborales,P,A,N,4,0,0,0,0,7756,5,7744,0,0
42719001,42719,0,0,,Provisiones para Prestaciones Laborales,P,A,N,5,0,0,0,0,7757,8,7756,0,0
42721,427,0,0,,Provisiones para Infraestructura,P,A,N,4,0,0,0,0,7758,5,7744,0,0
42721001,42721,0,0,,Provisiones para Infraestructura,P,A,N,5,0,0,0,0,7759,8,7758,0,0
42731,427,0,0,,Provisión por Emisión de Certificados de Traspaso,P,A,N,4,0,0,0,0,7760,5,7744,0,0
42731001,42731,0,0,,Provisión por Emisión de Certificados de Traspaso,P,A,N,5,0,0,0,0,7761,8,7760,0,0
42740,427,0,0,,Renegociación de Otras Obligaciones Financieras,P,A,N,4,0,0,0,0,7762,5,7744,0,0
42740001,42740,0,0,,Renegociación de Otras Obligaciones Financieras,P,A,N,5,0,0,0,0,7763,8,7762,0,0
42750,427,0,0,,Provisiones por Acreedores Monetarios,P,A,N,4,0,0,0,0,7764,5,7744,0,0
42750001,42750,0,0,,Provisiones por Acreedores Monetarios,P,A,N,5,0,0,0,0,7765,8,7764,0,0
42751,427,0,0,,Acreedores Monetarios por Pagar,P,A,N,4,0,0,0,0,7766,5,7744,0,0
42751001,42751,0,0,,Acreedores Monetarios por Pagar,P,A,N,5,0,0,0,0,7767,8,7766,0,0
42754,427,0,0,,Obligaciones por Bienes Muebles e Inmuebles Recibidos de Terceros,P,A,N,4,0,0,0,0,7768,5,7744,0,0
42754001,42754,0,0,,En Comodato,P,A,N,5,0,0,0,0,7769,8,7768,0,0
42754002,42754,0,0,,En Administración,P,A,N,5,0,0,0,0,7770,8,7768,0,0
42755,427,0,0,,Obligaciones por Préstamos de Existencias Institucionales,P,A,N,4,0,0,0,0,7771,5,7744,0,0
42755001,42755,0,0,,Productos Farmacéuticos Medicinales,P,A,N,5,0,0,0,0,7772,8,7771,0,0
42755002,42755,0,0,,"Materiales de Oficina, Productos de Papel e Impresos",P,A,N,5,0,0,0,0,7773,8,7771,0,0
42755003,42755,0,0,,Productos de Cuero y Caucho,P,A,N,5,0,0,0,0,7774,8,7771,0,0
42755004,42755,0,0,,"Maquinaria, Equipo y Mobiliario Diversos",P,A,N,5,0,0,0,0,7775,8,7771,0,0
42755099,42755,0,0,,Bienes de Uso y Consumo Diversos,P,A,N,5,0,0,0,0,7776,8,7771,0,0
42756,427,0,0,,Obligaciones por Bienes Muebles e Inmuebles en Extinción de Dominio,P,A,N,4,0,0,0,0,7777,5,7744,0,0
42756001,42756,0,0,,"Productos Alimenticios, Agropecuarios y Forestales",P,A,N,5,0,0,0,0,7778,8,7777,0,0
42756002,42756,0,0,,Productos Textiles y Vestuarios,P,A,N,5,0,0,0,0,7779,8,7777,0,0
42756003,42756,0,0,,"Materiales de Oficina, Productos de Papel e Impresos",P,A,N,5,0,0,0,0,7780,8,7777,0,0
42756004,42756,0,0,,Productos de Cuero y Caucho,P,A,N,5,0,0,0,0,7781,8,7777,0,0
42756005,42756,0,0,,"Productos Químicos, Combustibles y Lubricantes",P,A,N,5,0,0,0,0,7782,8,7777,0,0
42756006,42756,0,0,,Minerales y Productos Derivados,P,A,N,5,0,0,0,0,7783,8,7777,0,0
42756007,42756,0,0,,Materiales de Uso y Consumo,P,A,N,5,0,0,0,0,7784,8,7777,0,0
42756008,42756,0,0,,Bienes de Uso y Consumo Diverso,P,A,N,5,0,0,0,0,7785,8,7777,0,0
42756009,42756,0,0,,"Maquinaria, Equipo y Mobiliario Diverso",P,A,N,5,0,0,0,0,7786,8,7777,0,0
42756010,42756,0,0,,Maquinaria y Equipo de Producción,P,A,N,5,0,0,0,0,7787,8,7777,0,0
42756011,42756,0,0,,Equipos Médicos y de Laboratorios,P,A,N,5,0,0,0,0,7788,8,7777,0,0
42756012,42756,0,0,,"Equipo de Transporte, Tracción y Elevación",P,A,N,5,0,0,0,0,7789,8,7777,0,0
42756013,42756,0,0,,Bienes Inmuebles,P,A,N,5,0,0,0,0,7790,8,7777,0,0
42756014,42756,0,0,,"Obras de Arte, Libros y Colecciones",P,A,N,5,0,0,0,0,7791,8,7777,0,0
42756015,42756,0,0,,Semovientes,P,A,N,5,0,0,0,0,7792,8,7777,0,0
42756016,42756,0,0,,Equipo de Defensa y Seguridad Pública,P,A,N,5,0,0,0,0,7793,8,7777,0,0
42757,427,0,0,,Inversiones en Acciones Susctiras y no pagadas,P,A,N,4,0,0,0,0,7794,5,7744,0,0
42757001,42757,0,0,,Inversiones en Acciones Suscritas y no Pagadas,P,A,N,5,0,0,0,0,7795,8,7794,0,0
42798,427,0,0,,Provisión para Financiamiento de Terceros por Aplicar,P,A,N,4,0,0,0,0,7796,5,7744,0,0
42798001,42798,0,0,,Provisión para Financiamiento de Terceros por Aplicar,P,A,N,5,0,0,0,0,7797,8,7796,0,0
45456004,45456,0,0,,Productos de Cuero y Caucho,A,D,N,1,0,0,0,0,7798,8,0,0,0
45456005,45456,0,0,,"Productos Químicos, Combustibles y Lubricantes",A,D,N,1,0,0,0,0,7799,8,0,0,0
8,0,0,0,,Obligaciones Propias,C,A,N,1,0,0,0,0,7800,1,0,0,0
81,8,0,0,,Patrimonio Estatal,C,A,S,2,0,0,0,0,7801,2,7800,0,0
811,81,0,0,,Patrimonio,C,A,S,3,0,0,0,0,7802,3,7801,0,0
81101,811,0,0,,Patrimonio Gobierno Central,C,A,S,4,0,0,0,0,7803,5,7802,0,0
81101001,81101,0,0,,Patrimonio Gobierno Central,C,A,N,5,0,0,0,0,7804,8,7803,0,0
81103,811,0,0,,Patrimonio Instituciones Descentralizadas,C,A,S,4,0,0,0,0,7805,5,7802,0,0
81103001,81103,0,0,,Patrimonio Instituciones Descentralizadas,C,A,N,5,0,0,0,0,7806,8,7805,0,0
81103003,0,0,0,,Patrimonio Resultado Ejercicio 2003,A,D,N,1,0,0,0,0,7807,8,0,0,0
81103004,0,0,0,,Patrimonio Resultado Ejercicio 2004,A,D,N,1,0,0,0,0,7808,8,0,0,0
81105,811,0,0,,Patrimonio Municipalidades,C,A,S,4,0,0,0,0,7809,5,7802,0,0
81105001,81105,0,0,,Patrimonio Municipalidades,C,A,N,5,0,0,0,0,7810,8,7809,0,0
81107,811,0,0,,Donaciones y Legados Bienes Corporales,C,A,S,4,0,0,0,0,7811,5,7802,0,0
81107001,81107,0,0,,Donaciones y Legados Bienes Corporales,C,A,N,5,0,0,0,0,7812,8,7811,0,0
81109,811,0,0,,Resultado Ejercicios Anteriores,C,A,S,4,0,0,0,0,7813,5,7802,0,0
81109001,81109,0,0,,Resultado Ejercicios Anteriores,C,A,N,5,0,0,0,0,7814,8,7813,0,0
81111,811,0,0,,Resultado Ejercicio Corriente,C,A,S,4,0,0,0,0,7815,5,7802,0,0
81111001,81111,0,0,,Resultado Ejercicio Corriente,C,A,N,5,0,0,0,0,7816,8,7815,0,0
81111999,81111,0,0,,Resultados de Ejercicios Corrientes,C,A,N,5,0,0,0,0,7817,8,7815,0,0
81113,811,0,0,,Superávit por Revaluaciones,C,A,S,4,0,0,0,0,7818,5,7802,0,0
81113001,81113,0,0,,Superávit por Revaluaciones,C,A,N,5,0,0,0,0,7819,8,7818,0,0
81114,811,0,0,,Donaciones de Activos Financieros,C,A,S,4,0,0,0,0,7820,5,7802,0,0
81114001,81114,0,0,,Acciones,C,A,N,5,0,0,0,0,7821,8,7820,0,0
81114002,81114,0,0,,Bonos,C,A,N,5,0,0,0,0,7822,8,7820,0,0
81114003,81114,0,0,,Otros Títulos Valores,C,A,N,5,0,0,0,0,7823,8,7820,0,0
812,81,0,0,,Reservas,C,A,S,3,0,0,0,0,7824,3,7801,0,0
81201,812,0,0,,Reserva para Emergencias,C,A,S,4,0,0,0,0,7825,5,7824,0,0
81201001,81201,0,0,,Reserva para Emergencias,C,A,N,5,0,0,0,0,7826,8,7825,0,0
81203,812,0,0,,Reserva Técnica,C,A,S,4,0,0,0,0,7827,5,7824,0,0
81203001,81203,0,0,,Reserva Técnica,C,A,N,5,0,0,0,0,7828,8,7827,0,0
81205,812,0,0,,Reserva para Infraestructura,C,A,S,4,0,0,0,0,7829,5,7824,0,0
81205001,81205,0,0,,Reserva para Infraestructura,C,A,N,5,0,0,0,0,7830,8,7829,0,0
81207,812,0,0,,Reserva Laboral,C,A,S,4,0,0,0,0,7831,5,7824,0,0
81207001,81207,0,0,,Reserva Laboral,C,A,N,5,0,0,0,0,7832,8,7831,0,0
81209,812,0,0,,Reserva para Obligaciones con Terceros,C,A,S,4,0,0,0,0,7833,5,7824,0,0
81209001,81209,0,0,,Reserva para Obligaciones con Terceros,C,A,N,5,0,0,0,0,7834,8,7833,0,0
819,81,0,0,,Detrimento Patrimonial,C,D,S,3,0,0,0,0,7835,3,7801,0,0
81901,819,0,0,,Detrimentos de Fondos,C,D,S,4,0,0,6,3,7836,5,7835,0,0
81901001,81901,0,0,,Detrimento de Fondos,C,D,N,5,0,0,6,3,7837,8,7836,0,0
81903,819,0,0,,Detrimentos de Inversiones Financieras,C,D,S,4,0,0,0,0,7838,5,7835,0,0
81903001,81903,0,0,,Detrimentos de Inveriones Financieras,C,D,N,5,0,0,0,0,7839,8,7838,0,0
81905,819,0,0,,Detrimentos de Inversiones en Existencias,C,D,S,4,0,0,0,0,7840,5,7835,0,0
81905001,81905,0,0,,Detrimentos de Inversiones en Existencias,C,D,N,5,0,0,0,0,7841,8,7840,0,0
81907,819,0,0,,Detrimentos de Inversiones en Bienes de Uso,C,D,S,4,0,0,0,0,7842,5,7835,0,0
81907001,81907,0,0,,Detrimentos de Inveriones en Bienes de Uso,C,D,N,5,0,0,0,0,7843,8,7842,0,0
83,8,0,0,,Gastos de Gestión,E,D,S,2,0,0,0,0,7844,2,7800,0,0
831,83,0,0,,Gastos de Inversiones Públicas,E,D,S,3,0,0,0,0,7845,3,7844,0,0
83101,831,0,0,,Proyectos de Construcción de Infraestructura Vial,E,D,S,4,0,0,0,0,7846,5,7845,0,0
83101001,83101,0,0,,Proyectos de Construcción de Infraestructura Vial,E,D,N,5,0,0,0,0,7847,8,7846,0,0
83103,831,0,0,,Proyectos de Construcción de Lugares de Recreación,E,D,S,4,0,0,0,0,7848,5,7845,0,0
83103001,83103,0,0,,Proyectos de Construcción de Lugares de Recreación,E,D,N,5,0,0,0,0,7849,8,7848,0,0
83105,831,0,0,,Proyectos de Construcción de Obras Hidráulicas,E,D,S,4,0,0,0,0,7850,5,7845,0,0
83105001,83105,0,0,,Proyectos de Construcción de Obras Hidráulicas,E,D,N,5,0,0,0,0,7851,8,7850,0,0
83107,831,0,0,,Proyectos de Construcción de Obras Geotérmicas,E,D,S,4,0,0,0,0,7852,5,7845,0,0
83107001,83107,0,0,,Proyectos de Construcción de Obras Geotérmicas,E,D,N,5,0,0,0,0,7853,8,7852,0,0
83109,831,0,0,,Proyectos de Construcción de Obras Sanitarias,E,D,S,4,0,0,0,0,7854,5,7845,0,0
83109001,83109,0,0,,Proyectos de Construcción de Obras Sanitarias,E,D,N,5,0,0,0,0,7855,8,7854,0,0
83111,831,0,0,,Proyectos de Instalaciones Eléctricas y Comunicaciones,E,D,S,4,0,0,0,0,7856,5,7845,0,0
83111001,83111,0,0,,Proyectos de Instalaciones Eléctricas y Comunicaciones,E,D,N,5,0,0,0,0,7857,8,7856,0,0
83139,831,0,0,,Proyectos Privativos y Uso Público Diversos,E,D,S,4,0,0,0,0,7858,5,7845,0,0
83139001,83139,0,0,,Proyectos Privativos y Uso Público Diversos,E,D,N,5,0,0,0,0,7859,8,7858,0,0
83141,831,0,0,,Proyectos y Programas Educacionales,E,D,S,4,0,0,0,0,7860,5,7845,0,0
83141001,83141,0,0,,Proyectos y Programas Educacionales,E,D,N,5,0,0,0,0,7861,8,7860,0,0
83143,831,0,0,,Proyectos y Programas de Salud Pública,E,D,S,4,0,0,0,0,7862,5,7845,0,0
83143001,83143,0,0,,Proyectos y Programas de Salud Pública,E,D,N,5,0,0,0,0,7863,8,7862,0,0
83145,831,0,0,,Proyectos y Programas de Viviendas Básicas,E,D,S,4,0,0,0,0,7864,5,7845,0,0
83145001,83145,0,0,,Proyectos y Programas de Viviendas Básicas,E,D,N,5,0,0,0,0,7865,8,7864,0,0
83169,831,0,0,,Proyectos y Programas de Desarrollo Social Diversos,E,D,S,4,0,0,0,0,7866,5,7845,0,0
83169001,83169,0,0,,Proyectos y Programas de Desarrollo Social Diversos,E,D,N,5,0,0,0,0,7867,8,7866,0,0
83171,831,0,0,,Proyectos y Programas de Fomento Agropecuario,E,D,S,4,0,0,0,0,7868,5,7845,0,0
83171001,83171,0,0,,Proyectos y Programas de Fomento Agropecuario,E,D,N,5,0,0,0,0,7869,8,7868,0,0
83173,831,0,0,,Proyectos y Programas de Fomento Forestal,E,D,S,4,0,0,0,0,7870,5,7845,0,0
83173001,83173,0,0,,Proyectos y Programas de Fomento Forestal,E,D,N,5,0,0,0,0,7871,8,7870,0,0
83175,831,0,0,,Proyectos y Programas de Fomento Pesquero,E,D,S,4,0,0,0,0,7872,5,7845,0,0
83175001,83175,0,0,,Proyectos y Programas de Fomento Pesquero,E,D,N,5,0,0,0,0,7873,8,7872,0,0
83177,831,0,0,,Proyectos y Programas de Fomento Industrial,E,D,S,4,0,0,0,0,7874,5,7845,0,0
83177001,83177,0,0,,Proyectos y Programas de Fomento Industrial,E,D,N,5,0,0,0,0,7875,8,7874,0,0
83179,831,0,0,,Proyectos y Programas de Fomento Comercial,E,D,S,4,0,0,0,0,7876,5,7845,0,0
