code,parent_code,budget_income,budget_expense,COD_INS_CAR_TRA,NOMB_CTA_CONT_CENT,TIPO_CUEN_CONT,NATURA_SALDO,TIENE_SUBCTA,NIVEL,TIPO_EJEC_PTO_INGR,TIPO_EJEC_PTO_EGRE,TIP_FLU_FDO_DEB,TIP_FLU_FDO_HAB,id_temporal,longitud,parent_id,budget_income_id_temporal,budget_expense_id_temporal
41355104,41355,0,0,,Alcaldía Municipal de Concepción de Ataco,P,A,N,5,0,0,4,0,4886,8,4883,0,0
41355108,41355,0,0,,Alcaldía Municipal de San Francisco Menéndez,P,A,N,5,0,0,4,0,4887,8,4883,0,0
41355113,41355,0,0,,Alcaldía Municipal de Candelaria de La Frontera,P,A,N,5,0,0,4,0,4888,8,4883,0,0
41355122,41355,0,0,,Alcaldía Municipal de Santa Ana,P,A,N,5,0,0,4,0,4889,8,4883,0,0
41355126,41355,0,0,,Alcaldía Municipal de Acajutal,P,A,N,5,0,0,4,0,4890,8,4883,0,0
41355136,41355,0,0,,Alcaldía Municipal de San Antonio del Monte,P,A,N,5,0,0,4,0,4891,8,4883,0,0
41355145,41355,0,0,,Alcaldía Municipal de Cítala,P,A,N,5,0,0,4,0,4892,8,4883,0,0
41355185,41355,0,0,,Alcaldia Municipal de Santa Tecla,P,A,N,5,0,0,4,0,4893,8,4883,0,0
41355203,41355,0,0,,Alcaldía Municipal de Ilopango,P,A,N,5,0,0,4,0,4894,8,4883,0,0
41355206,41355,0,0,,Alcaldía Municipal de Panchimalco,P,A,N,5,0,0,4,0,4895,8,4883,0,0
41355210,41355,0,0,,Alcaldía Municipal de San Salvador,P,A,N,5,0,0,4,0,4896,8,4883,0,0
41355213,41355,0,0,,Alcaldía Municipal de Soyapango,P,A,N,5,0,0,4,0,4897,8,4883,0,0
41355217,41355,0,0,,Alcaldía Municipal de Cojutepeque,P,A,N,5,0,0,4,0,4898,8,4883,0,0
41355261,41355,0,0,,Alcaldia Municipal de Victoria,P,A,N,5,0,0,4,0,4899,8,4883,0,0
41355272,41355,0,0,,Alcaldía Municipal de San Vicente,P,A,N,5,0,0,4,0,4900,8,4883,0,0
41355296,41355,0,0,,Alcaldía Municipal de Santiago de María,P,A,N,5,0,0,4,0,4901,8,4883,0,0
41355298,41355,0,0,,Alcaldía Municipal de Usulután,P,A,N,5,0,0,4,0,4902,8,4883,0,0
41355315,41355,0,0,,Alcaldía Municipal de San Miguel,P,A,N,5,0,0,4,0,4903,8,4883,0,0
41355352,41355,0,0,,Alcaldía Municipal de La Unión,P,A,N,5,0,0,4,0,4904,8,4883,0,0
41355356,41355,0,0,,Alcaldía Municipal de Pasaquina,P,A,N,5,0,0,4,0,4905,8,4883,0,0
41355363,41355,0,0,,Municipio de Ahuachapán Norte,P,A,N,5,0,0,4,0,4906,8,4883,0,0
41355364,41355,0,0,,Municipio de Ahuachapán Centro ,P,A,N,5,0,0,4,0,4907,8,4883,0,0
41355365,41355,0,0,,Municipio de Ahuachapán Sur,P,A,N,5,0,0,4,0,4908,8,4883,0,0
41355366,41355,0,0,,Municipio de Santa Ana Norte,P,A,N,5,0,0,4,0,4909,8,4883,0,0
41355367,41355,0,0,,Municipio de Santa Ana Centro,P,A,N,5,0,0,4,0,4910,8,4883,0,0
41355368,41355,0,0,,Municipio de Santa Ana Este,P,A,N,5,0,0,4,0,4911,8,4883,0,0
41355369,41355,0,0,,Municipio de Santa Ana Oeste,P,A,N,5,0,0,4,0,4912,8,4883,0,0
41355370,41355,0,0,,Municipio de Sonsonate Norte,P,A,N,5,0,0,4,0,4913,8,4883,0,0
41355371,41355,0,0,,Municipio de Sonsonate Centro,P,A,N,5,0,0,4,0,4914,8,4883,0,0
41355372,41355,0,0,,Municipio de Sonsonate Este,P,A,N,5,0,0,4,0,4915,8,4883,0,0
41355373,41355,0,0,,Municipio de Sonsonate Oeste,P,A,N,5,0,0,4,0,4916,8,4883,0,0
41355374,41355,0,0,,Municipio de Chalatenango Norte,P,A,N,5,0,0,4,0,4917,8,4883,0,0
41355375,41355,0,0,,Municipio de Chalatenango Centro,P,A,N,5,0,0,4,0,4918,8,4883,0,0
41355376,41355,0,0,,Municipio de Chalatenango Sur,P,A,N,5,0,0,4,0,4919,8,4883,0,0
41355377,41355,0,0,,Municipio de La Libertad Norte,P,A,N,5,0,0,4,0,4920,8,4883,0,0
41355378,41355,0,0,,Municipio de La Libertad Centro,P,A,N,5,0,0,4,0,4921,8,4883,0,0
41355379,41355,0,0,,Municipio de La Libertad Sur,P,A,N,5,0,0,4,0,4922,8,4883,0,0
41355380,41355,0,0,,Municipio de la Libertad Este,P,A,N,5,0,0,4,0,4923,8,4883,0,0
41355381,41355,0,0,,Municipio de La Libertad Oeste,P,A,N,5,0,0,4,0,4924,8,4883,0,0
41355382,41355,0,0,,Municipio de La Libertad Costa,P,A,N,5,0,0,4,0,4925,8,4883,0,0
41355383,41355,0,0,,Municipio de San Salvador Norte,P,A,N,5,0,0,4,0,4926,8,4883,0,0
41355384,41355,0,0,,Municipio de San Salvador Centro,P,A,N,5,0,0,4,0,4927,8,4883,0,0
41355385,41355,0,0,,Municipio de San Salvador Sur,P,A,N,5,0,0,4,0,4928,8,4883,0,0
41355386,41355,0,0,,Municipio de San Salvador Este,P,A,N,5,0,0,4,0,4929,8,4883,0,0
41355387,41355,0,0,,Municipio de San Salvador Oeste,P,A,N,5,0,0,4,0,4930,8,4883,0,0
41355388,41355,0,0,,Municipio de Cuscatlán Norte,P,A,N,5,0,0,4,0,4931,8,4883,0,0
41355389,41355,0,0,,Municipio de Cuscatlán Sur,P,A,N,5,0,0,4,0,4932,8,4883,0,0
41355390,41355,0,0,,Municipio de La Paz Centro,P,A,N,5,0,0,4,0,4933,8,4883,0,0
41355391,41355,0,0,,Municipio de La Paz Este,P,A,N,5,0,0,4,0,4934,8,4883,0,0
41355392,41355,0,0,,Municipio de La Paz Oeste,P,A,N,5,0,0,4,0,4935,8,4883,0,0
41355393,41355,0,0,,Municipio de Cabañas Este,P,A,N,5,0,0,4,0,4936,8,4883,0,0
41355394,41355,0,0,,Municipio de La Cabañas Oeste,P,A,N,5,0,0,4,0,4937,8,4883,0,0
41355395,41355,0,0,,Municipio de San Vicente Norte,P,A,N,5,0,0,4,0,4938,8,4883,0,0
41355396,41355,0,0,,Municipio de San Vicente Sur,P,A,N,5,0,0,4,0,4939,8,4883,0,0
41355397,41355,0,0,,Municipio de Usulután Norte,P,A,N,5,0,0,4,0,4940,8,4883,0,0
41355398,41355,0,0,,Municipio de Usulután Este,P,A,N,5,0,0,4,0,4941,8,4883,0,0
41355399,41355,0,0,,Municipio de Usulután Oeste,P,A,N,5,0,0,4,0,4942,8,4883,0,0
41355400,41355,0,0,,Municipio de San Miguel Norte,P,A,N,5,0,0,4,0,4943,8,4883,0,0
41355401,41355,0,0,,Municipio de San Miguel Centro,P,A,N,5,0,0,4,0,4944,8,4883,0,0
41355402,41355,0,0,,Municipio de San Miguel Oeste,P,A,N,5,0,0,4,0,4945,8,4883,0,0
41355403,41355,0,0,,Municipio de Morazán Norte,P,A,N,5,0,0,4,0,4946,8,4883,0,0
41355404,41355,0,0,,Municipio de Morazán Sur,P,A,N,5,0,0,4,0,4947,8,4883,0,0
41355405,41355,0,0,,Municipio de La Unión Norte,P,A,N,5,0,0,4,0,4948,8,4883,0,0
41355406,41355,0,0,,Municipio de La Unión Sur,P,A,N,5,0,0,4,0,4949,8,4883,0,0
41355800,41355,0,0,100.0,Asamblea Legislativa,P,A,N,5,0,0,4,0,4950,8,4883,0,0
41355802,41355,0,0,1600.0,Corte Suprema de Justicia,P,A,N,5,0,0,4,0,4951,8,4883,0,0
41355803,41355,0,0,1601.0,Caja Mutual del Abogado de El Salvador (CAMUDASAL),P,A,N,5,0,0,4,0,4952,8,4883,0,0
41355804,41355,0,0,1602.0,Consejo Nacional de la Judicatura,P,A,N,5,0,0,4,0,4953,8,4883,0,0
41355805,41355,0,0,200.0,Corte de Cuentas de la República,P,A,N,5,0,0,4,0,4954,8,4883,0,0
41355807,41355,0,0,300.0,Tribunal Supremo Electoral,P,A,N,5,0,0,4,0,4955,8,4883,0,0
41355808,41355,0,0,301.0,Registro Nacional de las Personas Naturales,P,A,N,5,0,0,4,0,4956,8,4883,0,0
41355810,41355,0,0,400.0,Tribunal de Servicio Civil,P,A,N,5,0,0,4,0,4957,8,4883,0,0
41355812,41355,0,0,1700.0,Fiscalía General de la República,P,A,N,5,0,0,4,0,4958,8,4883,0,0
41355814,41355,0,0,1800.0,Procuraduría General de la República,P,A,N,5,0,0,4,0,4959,8,4883,0,0
41355816,41355,0,0,1900.0,Procuraduría para la Defensa de los Derechos Humanos,P,A,N,5,0,0,4,0,4960,8,4883,0,0
41355818,41355,0,0,500.0,Presidencia de la República,P,A,N,5,0,0,4,0,4961,8,4883,0,0
41355819,41355,0,0,501.0,Instituto Nacional de los Deportes de El Salvador (INDES),P,A,N,5,0,0,4,0,4962,8,4883,0,0
41355820,41355,0,0,502.0,Instituto Salvadoreño Para el Desarrollo Integral de la Niñes y Adolescencia,P,A,N,5,0,0,4,0,4963,8,4883,0,0
41355821,41355,0,0,503.0,Administración Nacional de Telecomunicaciones (ANTEL),P,A,N,5,0,0,4,0,4964,8,4883,0,0
41355822,41355,0,0,504.0,Instituto Salvadoreño para el Desarrollo de la Mujer (ISDEMU),P,A,N,5,0,0,4,0,4965,8,4883,0,0
41355823,41355,0,0,505.0,Fondo de Inversión Social para el Desarrollo Local de El Salvador (FISDL),P,A,N,5,0,0,4,0,4966,8,4883,0,0
41355824,41355,0,0,,Fondo Solidario para la Familia Microempresaria (FOSOFAMILIA),P,A,N,5,0,0,4,0,4967,8,4883,0,0
41355825,41355,0,0,700.0,Ministerio de Hacienda - GOES,P,A,N,5,0,0,4,0,4968,8,4883,0,0
41355826,41355,0,0,701.0,Lotería Nacional de Beneficencia (LNB),P,A,N,5,0,0,4,0,4969,8,4883,0,0
41355827,41355,0,0,702.0,Instituto Nacional de Pensiones de los Empleados Públicos (INPEP),P,A,N,5,0,0,4,0,4970,8,4883,0,0
41355828,41355,0,0,704.0,Fondo Salvadoreño para Estudios de Preinversión (FOSEP),P,A,N,5,0,0,4,0,4971,8,4883,0,0
41355830,41355,0,0,800.0,Ministerio de Relaciones Exteriores,P,A,N,5,0,0,4,0,4972,8,4883,0,0
41355831,41355,0,0,,Secretaría Externa de Financiamiento Externo (SETEFE),P,A,N,5,0,0,4,0,4973,8,4883,0,0
41355833,41355,0,0,2000.0,Ministerio del Interior,P,A,N,5,0,0,4,0,4974,8,4883,0,0
41355834,41355,0,0,2002.0,Instituto Salvadoreño de Desarrollo Municipal (ISDEM),P,A,N,5,0,0,4,0,4975,8,4883,0,0
41355836,41355,0,0,900.0,Ministerio de la Defensa Nacional,P,A,N,5,0,0,4,0,4976,8,4883,0,0
41355837,41355,0,0,901.0,Instituto de Previsión Social de la Fuerza Armada (IPSFA),P,A,N,5,0,0,4,0,4977,8,4883,0,0
41355838,41355,0,0,902.0,Centro Farmacéutico de la Fuerza Armada (CEFAFA),P,A,N,5,0,0,4,0,4978,8,4883,0,0
41355840,41355,0,0,2100.0,Ministerio de Seguridad Pública y Justicia,P,A,N,5,0,0,4,0,4979,8,4883,0,0
41355841,41355,0,0,2101.0,Academia Nacional de Seguridad Pública (ANSP),P,A,N,5,0,0,4,0,4980,8,4883,0,0
41355842,41355,0,0,2202.0,Unidad Técnica Ejecutiva (UTE),P,A,N,5,0,0,4,0,4981,8,4883,0,0
41355843,41355,0,0,2200.0,Ministerio de Justicia,P,A,N,5,0,0,4,0,4982,8,4883,0,0
41355847,41355,0,0,3100.0,Ministerio de Educación,P,A,N,5,0,0,4,0,4983,8,4883,0,0
41355848,41355,0,0,3101.0,Universidad de El Salvador (UES),P,A,N,5,0,0,4,0,4984,8,4883,0,0
41355849,41355,0,0,3102.0,Federación Salvadoreña de Fútbol (FEDEFUTBOL),P,A,N,5,0,0,4,0,4985,8,4883,0,0
41355850,41355,0,0,3104.0,Fondo de Garantía para el Crédito Educativo (EDUCREDITO),P,A,N,5,0,0,4,0,4986,8,4883,0,0
41355851,41355,0,0,3105.0,Caja Mutual de los Empleados del Ministerio de Educación,P,A,N,5,0,0,4,0,4987,8,4883,0,0
41355853,41355,0,0,3200.0,Ministerio de Salud Pública y Asistencia Social,P,A,N,5,0,0,4,0,4988,8,4883,0,0
41355854,41355,0,0,3201.0,Hospital Nacional Rosales,P,A,N,5,0,0,4,0,4989,8,4883,0,0
41355855,41355,0,0,3202.0,"Hospital Nacional ""Benjamín Bloom""",P,A,N,5,0,0,4,0,4990,8,4883,0,0
41355856,41355,0,0,3203.0,"Hospital Nacional de Maternidad ""Dr. Raúl Arguello Escolán""",P,A,N,5,0,0,4,0,4991,8,4883,0,0
41355857,41355,0,0,3204.0,"Hospital Nacional Psiquiátrico ""Dr. José Molina Martínez""",P,A,N,5,0,0,4,0,4992,8,4883,0,0
41355858,41355,0,0,3205.0,"Hospital Nacional Neumológico ""Dr. José Antonio Zaldaña""",P,A,N,5,0,0,4,0,4993,8,4883,0,0
41355859,41355,0,0,3206.0,"Hospital Nacional ""San Juan de Dios"", Santa Ana",P,A,N,5,0,0,4,0,4994,8,4883,0,0
41355860,41355,0,0,3207.0,"Hospital Nacional ""Francisco Menéndez"", Ahuachapán",P,A,N,5,0,0,4,0,4995,8,4883,0,0
41355861,41355,0,0,3208.0,"Hospital Nacional ""Dr.Jorge Mazzini Villacorta"", Sonsonate",P,A,N,5,0,0,4,0,4996,8,4883,0,0
41355862,41355,0,0,3209.0,"Hospital Nacional ""Dr. Luis Edmundo Vásquez"", Chalatenango",P,A,N,5,0,0,4,0,4997,8,4883,0,0
41355863,41355,0,0,3210.0,"Hospital Nacional ""San Rafael"", Nueva San Salvador",P,A,N,5,0,0,4,0,4998,8,4883,0,0
41355864,41355,0,0,3211.0,"Hospital Nacional ""Santa Gertrudis"", San Vicente",P,A,N,5,0,0,4,0,4999,8,4883,0,0
41355865,41355,0,0,3212.0,"Hospital Nacional ""Santa Teresa"", Zacatecoluca",P,A,N,5,0,0,4,0,5000,8,4883,0,0
41355866,41355,0,0,3213.0,"Hospital Nacional ""San Juan de Dios"", San Miguel",P,A,N,5,0,0,4,0,5001,8,4883,0,0
41355867,41355,0,0,3214.0,"Hospital Nacional ""San Pedro"" Usulután",P,A,N,5,0,0,4,0,5002,8,4883,0,0
41355868,41355,0,0,3215.0,"Hospital Nacional ""Dr. Juan José Fernández"", Zacamil",P,A,N,5,0,0,4,0,5003,8,4883,0,0
41355869,41355,0,0,3216.0,Hospital Nacional San Bartolo,P,A,N,5,0,0,4,0,5004,8,4883,0,0
41355870,41355,0,0,3217.0,Hospital Nacional de Cojutepeque,P,A,N,5,0,0,4,0,5005,8,4883,0,0
41355871,41355,0,0,3218.0,Hospital Nacional de La Unión,P,A,N,5,0,0,4,0,5006,8,4883,0,0
41355872,41355,0,0,3219.0,Hospital Nacional de Ilobasco,P,A,N,5,0,0,4,0,5007,8,4883,0,0
41355873,41355,0,0,3220.0,Hospital Nacional de Nueva Guadalupe,P,A,N,5,0,0,4,0,5008,8,4883,0,0
41355874,41355,0,0,3221.0,Hospital Nacional de Ciudad Barrios,P,A,N,5,0,0,4,0,5009,8,4883,0,0
41355875,41355,0,0,3222.0,Hospital Nacional de Sensuntepeque,P,A,N,5,0,0,4,0,5010,8,4883,0,0
41355876,41355,0,0,3223.0,Hospital Nacional de Chalchuapa,P,A,N,5,0,0,4,0,5011,8,4883,0,0
41355877,41355,0,0,3224.0,Hospital Nacional de Metapán,P,A,N,5,0,0,4,0,5012,8,4883,0,0
41355878,41355,0,0,3225.0,Hospital Nacional de San Francisco Gotera,P,A,N,5,0,0,4,0,5013,8,4883,0,0
41355879,41355,0,0,3226.0,Hospital Nacional de Santa Rosa de Lima,P,A,N,5,0,0,4,0,5014,8,4883,0,0
41355880,41355,0,0,3227.0,Hospital Nacional de Nueva Concepción,P,A,N,5,0,0,4,0,5015,8,4883,0,0
41355881,41355,0,0,3228.0,Hospital Nacional de Santiago de María,P,A,N,5,0,0,4,0,5016,8,4883,0,0
41355882,41355,0,0,3229.0,Hospital Nacional de Jiquilisco,P,A,N,5,0,0,4,0,5017,8,4883,0,0
41355883,41355,0,0,3230.0,Hospital Nacional de Suchitoto,P,A,N,5,0,0,4,0,5018,8,4883,0,0
41355884,41355,0,0,3231.0,Consejo Superior de Salud Pública,P,A,N,5,0,0,4,0,5019,8,4883,0,0
41355885,41355,0,0,3232.0,Instituto Salvadoreño de Rehabilitación de Inválidos (ISRI),P,A,N,5,0,0,4,0,5020,8,4883,0,0
41355886,41355,0,0,3233.0,"Hogar de Ancianos ""Narcisa Castillo"", Santa Ana",P,A,N,5,0,0,4,0,5021,8,4883,0,0
41355887,41355,0,0,3234.0,Cruz Roja Salvadoreña (CR),P,A,N,5,0,0,4,0,5022,8,4883,0,0
41355890,41355,0,0,3300.0,Ministerio de Trabajo y Previsión Social,P,A,N,5,0,0,4,0,5023,8,4883,0,0
41355891,41355,0,0,3300.0,Instituto Salvadoreño de Fomento Cooperativo (INSAFOCOOP),P,A,N,5,0,0,4,0,5024,8,4883,0,0
41355892,41355,0,0,3302.0,Instituto Salvadoreño de Formación Profesional (INSAFORP),P,A,N,5,0,0,4,0,5025,8,4883,0,0
41355893,41355,0,0,3303.0,Instituto Salvadoreño del Seguro Social (ISSS),P,A,N,5,0,0,4,0,5026,8,4883,0,0
41355894,41355,0,0,3304.0,Fondo de Protección de Lisiados y Discapacitados a Consecuencia del Conflicto A.,P,A,N,5,0,0,4,0,5027,8,4883,0,0
41355896,41355,0,0,4100.0,Ministerio de Economía,P,A,N,5,0,0,4,0,5028,8,4883,0,0
41355897,41355,0,0,4101.0,Centro Internacional de Ferias y Convenciones de El Salvador,P,A,N,5,0,0,4,0,5029,8,4883,0,0
41355898,41355,0,0,4102.0,Consejo Nacional de Ciencia y Tecnología (CONACYT),P,A,N,5,0,0,4,0,5030,8,4883,0,0
41355899,41355,0,0,4103.0,Consejo de Vigilancia de la Contaduría Pública y Auditoría,P,A,N,5,0,0,4,0,5031,8,4883,0,0
41355900,41355,0,0,4104.0,Instituto Salvadoreño de Turismo (ISTU),P,A,N,5,0,0,4,0,5032,8,4883,0,0
41355901,41355,0,0,4105.0,Consejo Salvadoreño del Café (CSC),P,A,N,5,0,0,4,0,5033,8,4883,0,0
41355902,41355,0,0,4106.0,Comisión Ejecutiva Hidroeléctrica del Río Lempa (CEL),P,A,N,5,0,0,4,0,5034,8,4883,0,0
41355903,41355,0,0,4107.0,Fondo de Financiamiento y Garantía para la Pequeña Empresa (FIGAPE),P,A,N,5,0,0,4,0,5035,8,4883,0,0
41355904,41355,0,0,4108.0,Corporación Salvadoreña de Turismo (CORSATUR),P,A,N,5,0,0,4,0,5036,8,4883,0,0
41355905,41355,0,0,4109.0,Superintendencia General de Electricidad y Telecomunicaciones (SIGET),P,A,N,5,0,0,4,0,5037,8,4883,0,0
41355906,41355,0,0,4110.0,Superintendencia de Valores (S.V.),P,A,N,5,0,0,4,0,5038,8,4883,0,0
41355907,41355,0,0,4111.0,Superintendencia de Pensiones (S.P.),P,A,N,5,0,0,4,0,5039,8,4883,0,0
41355908,41355,0,0,4112.0,Corporación  Salvadoreña de Inversiones (CORSAIN),P,A,N,5,0,0,4,0,5040,8,4883,0,0
41355909,41355,0,0,4113.0,Instituto Nacional del Azúcar (INAZUCAR),P,A,N,5,0,0,4,0,5041,8,4883,0,0
41355910,41355,0,0,4115.0,Fondo de Inversión Nacional de Electricidad y Telefonía (FINET),P,A,N,5,0,0,4,0,5042,8,4883,0,0
41355911,41355,0,0,4114.0,Centro Nacional de Registros (CNR),P,A,N,5,0,0,4,0,5043,8,4883,0,0
41355914,41355,0,0,4200.0,Ministerio de Agricultura y Ganadería,P,A,N,5,0,0,4,0,5044,8,4883,0,0
41355915,41355,0,0,4201.0,Instituto Salvadoreño de Transformación Agraria (ISTA),P,A,N,5,0,0,4,0,5045,8,4883,0,0
41355916,41355,0,0,4202.0,Centro Nacional de Tecnología Agropecuaria y Forestal (CENTA),P,A,N,5,0,0,4,0,5046,8,4883,0,0
41355917,41355,0,0,4203.0,Escuela Nacional de Agricultura (ENA),P,A,N,5,0,0,4,0,5047,8,4883,0,0
41355919,41355,0,0,4300.0,Ministerio de Obras Públicas,P,A,N,5,0,0,4,0,5048,8,4883,0,0
41355920,41355,0,0,4301.0,Administración Nacional de Acueductos y Alcantarillados (ANDA),P,A,N,5,0,0,4,0,5049,8,4883,0,0
41355921,41355,0,0,4302.0,Fondo Social para la Vivienda (FSV),P,A,N,5,0,0,4,0,5050,8,4883,0,0
41355922,41355,0,0,4303.0,Comisión Ejecutiva Portuaria Autónoma (CEPA),P,A,N,5,0,0,4,0,5051,8,4883,0,0
41355924,41355,0,0,,Autoridad Marítima Portuaria,P,A,N,5,0,0,4,0,5052,8,4883,0,0
41355925,41355,0,0,3400.0,Ministerio de Vivienda y Desarrollo Urbano,P,A,N,5,0,0,4,0,5053,8,4883,0,0
41355926,41355,0,0,3401.0,Fondo Nacional de Vivienda Popular (FONAVIPO),P,A,N,5,0,0,4,0,5054,8,4883,0,0
41355928,41355,0,0,4400.0,Ministerio de Medio Ambiente y Recursos Naturales,P,A,N,5,0,0,4,0,5055,8,4883,0,0
41355929,41355,0,0,4401.0,Fondo Ambiental de El Salvador (FONAES),P,A,N,5,0,0,4,0,5056,8,4883,0,0
41355931,41355,0,0,4500.0,Ministerio de Transporte,P,A,N,5,0,0,4,0,5057,8,4883,0,0
41355933,41355,0,0,,Obligaciones y Transferencias Generales del Estado,P,A,N,5,0,0,4,0,5058,8,4883,0,0
41355934,41355,0,0,,Deuda Pública,P,A,N,5,0,0,4,0,5059,8,4883,0,0
41355935,41355,0,0,703.0,Tesoro Público (DGT),P,A,N,5,0,0,4,0,5060,8,4883,0,0
41355937,41355,0,0,,Corporación de Municipalidades de la República de El Salvador (COMURES),P,A,N,5,0,0,4,0,5061,8,4883,0,0
41355938,41355,0,0,,Oficina de Planificación del Area Metropolitana de San Salvador (OPAMSS),P,A,N,5,0,0,4,0,5062,8,4883,0,0
41355940,41355,0,0,,Ministerio de Turismo,P,A,N,5,0,0,4,0,5063,8,4883,0,0
41355945,41355,0,0,2400.0,Ministerio de Justicia y Seguridad Pùblica,P,A,N,5,0,0,4,0,5064,8,4883,0,0
41355947,41355,0,0,4119.0,Consejo Nacional de Energía,P,A,N,5,0,0,4,0,5065,8,4883,0,0
41355950,41355,0,0,,Municipios del Departamento de San Salvador,P,A,N,5,0,0,4,0,5066,8,4883,0,0
41355951,41355,0,0,,Municipios del Departamento de Santa Ana,P,A,N,5,0,0,4,0,5067,8,4883,0,0
41355952,41355,0,0,,Municipios del Departamento de Ahuachapán,P,A,N,5,0,0,4,0,5068,8,4883,0,0
41355953,41355,0,0,,Municipios del Departamento de Sonsonate,P,A,N,5,0,0,4,0,5069,8,4883,0,0
41355954,41355,0,0,,Municipios del Departamento de Chalatenango,P,A,N,5,0,0,4,0,5070,8,4883,0,0
41355955,41355,0,0,,Municipios del Departamento de La Libertad,P,A,N,5,0,0,4,0,5071,8,4883,0,0
41355956,41355,0,0,,Municipios del Departamento de Cuscatlán,P,A,N,5,0,0,4,0,5072,8,4883,0,0
41355957,41355,0,0,,Municipios del Departamento de La Paz,P,A,N,5,0,0,4,0,5073,8,4883,0,0
41355958,41355,0,0,,Municipios del Departamento de San Vicente,P,A,N,5,0,0,4,0,5074,8,4883,0,0
41355959,41355,0,0,,Municipios del Departamento de Cabañas,P,A,N,5,0,0,4,0,5075,8,4883,0,0
41355960,41355,0,0,,Municipios del Departamento de Usulután,P,A,N,5,0,0,4,0,5076,8,4883,0,0
41355961,41355,0,0,,Municipios del Departamento de San Miguel,P,A,N,5,0,0,4,0,5077,8,4883,0,0
41355962,41355,0,0,,Municipios del Departamento de Morazán,P,A,N,5,0,0,4,0,5078,8,4883,0,0
41355963,41355,0,0,,Municipios del Departamento de La Unión,P,A,N,5,0,0,4,0,5079,8,4883,0,0
41355964,41355,0,0,,Corporación de Municipalidades de la Repúbllica de El Salvador (COMURES),P,A,N,5,0,0,4,0,5080,8,4883,0,0
41355965,41355,0,0,,Oficina de Planificación del Área Metropolitana de San Salvador (OPAMSS),P,A,N,5,0,0,4,0,5081,8,4883,0,0
41355966,41355,0,0,,Asociación Intermunicipal Energía para El Salvador,P,A,N,5,0,0,4,0,5082,8,4883,0,0
41355967,41355,0,0,3236.0,Dirección Nacional de Medicamentos,P,A,N,5,0,0,4,0,5083,8,4883,0,0
41355970,41355,0,0,2403.0,Consejo Nacional de Administración de Bienes (CONAB),P,A,N,5,0,0,4,0,5084,8,4883,0,0
41355971,41355,0,0,3203.0,Hospital Nacional de la Mujer,P,A,N,5,0,0,4,0,5085,8,4883,0,0
41355979,41355,0,0,2304.0,Instituto Admon. de los Beneficios y Presta. de los Veteranos... INABVE,P,A,N,5,0,0,4,0,5086,8,4883,0,0
41355985,41355,0,0,4404.0,Autoridad Salvadoreña del Agua (ASA),P,A,N,5,0,0,4,0,5087,8,4883,0,0
41355992,41355,0,0,2306.0,Cuerpo de Bomberos de El Salcvador (CBES),P,A,N,5,0,0,4,0,5088,8,4883,0,0
41355997,41355,0,0,,Saldos Transitorios FAE,P,A,N,5,0,0,4,0,5089,8,4883,0,0
41356,413,0,56,,A.M. x Transferencias Corrientes Otorgadas,P,A,S,4,0,2,4,0,5090,5,4407,0,742
41356001,41356,0,0,,Transferencias Corrientes Otorgadas,P,A,N,5,0,0,4,0,5091,8,5090,0,0
41356101,41356,0,0,8101.0,Ahuachapán,P,A,N,5,0,0,4,0,5092,8,5090,0,0
41356102,41356,0,0,8102.0,Apaneca,P,A,N,5,0,0,4,0,5093,8,5090,0,0
41356103,41356,0,0,8103.0,Atiquizaya,P,A,N,5,0,0,4,0,5094,8,5090,0,0
41356104,41356,0,0,8104.0,Concepción de Ataco,P,A,N,5,0,0,4,0,5095,8,5090,0,0
41356105,41356,0,0,8105.0,El Refugio,P,A,N,5,0,0,4,0,5096,8,5090,0,0
41356106,41356,0,0,8106.0,Guaymango,P,A,N,5,0,0,4,0,5097,8,5090,0,0
41356107,41356,0,0,8107.0,Jujutla,P,A,N,5,0,0,4,0,5098,8,5090,0,0
41356108,41356,0,0,8108.0,San Francisco Menéndez,P,A,N,5,0,0,4,0,5099,8,5090,0,0
41356109,41356,0,0,8109.0,San Lorenzo,P,A,N,5,0,0,4,0,5100,8,5090,0,0
41356110,41356,0,0,8110.0,San Pedro Puxtla,P,A,N,5,0,0,4,0,5101,8,5090,0,0
41356111,41356,0,0,8111.0,Tacuba,P,A,N,5,0,0,4,0,5102,8,5090,0,0
41356112,41356,0,0,8112.0,Turín,P,A,N,5,0,0,4,0,5103,8,5090,0,0
41356113,41356,0,0,8201.0,Candelaria de la Frontera,P,A,N,5,0,0,4,0,5104,8,5090,0,0
41356114,41356,0,0,8202.0,Coatepeque,P,A,N,5,0,0,4,0,5105,8,5090,0,0
41356115,41356,0,0,8203.0,Chalchuapa,P,A,N,5,0,0,4,0,5106,8,5090,0,0
41356116,41356,0,0,8204.0,El Congo,P,A,N,5,0,0,4,0,5107,8,5090,0,0
41356117,41356,0,0,8205.0,El Porvenir,P,A,N,5,0,0,4,0,5108,8,5090,0,0
41356118,41356,0,0,8206.0,Masahuat,P,A,N,5,0,0,4,0,5109,8,5090,0,0
41356119,41356,0,0,8207.0,Metapán,P,A,N,5,0,0,4,0,5110,8,5090,0,0
41356120,41356,0,0,8208.0,San Antonio Pajonal,P,A,N,5,0,0,4,0,5111,8,5090,0,0
41356121,41356,0,0,8209.0,San Sebastián Salitrillo,P,A,N,5,0,0,4,0,5112,8,5090,0,0
41356122,41356,0,0,8210.0,Santa Ana,P,A,N,5,0,0,4,0,5113,8,5090,0,0
41356123,41356,0,0,8211.0,Santa Rosa Guachipilín,P,A,N,5,0,0,4,0,5114,8,5090,0,0
41356124,41356,0,0,8212.0,Santiago de la Frontera,P,A,N,5,0,0,4,0,5115,8,5090,0,0
41356125,41356,0,0,8213.0,Texistepeque,P,A,N,5,0,0,4,0,5116,8,5090,0,0
41356126,41356,0,0,8301.0,Acajutla,P,A,N,5,0,0,4,0,5117,8,5090,0,0
41356127,41356,0,0,8302.0,Armenia,P,A,N,5,0,0,4,0,5118,8,5090,0,0
41356128,41356,0,0,8303.0,Caluco,P,A,N,5,0,0,4,0,5119,8,5090,0,0
41356129,41356,0,0,8304.0,Cuisnahuat,P,A,N,5,0,0,4,0,5120,8,5090,0,0
41356130,41356,0,0,8305.0,Santa Isabel de Ishuatán,P,A,N,5,0,0,4,0,5121,8,5090,0,0
41356131,41356,0,0,8306.0,Izalco,P,A,N,5,0,0,4,0,5122,8,5090,0,0
41356132,41356,0,0,8307.0,Juayúa,P,A,N,5,0,0,4,0,5123,8,5090,0,0
41356133,41356,0,0,8308.0,Nahuizalco,P,A,N,5,0,0,4,0,5124,8,5090,0,0
41356134,41356,0,0,8309.0,Nahuilingo,P,A,N,5,0,0,4,0,5125,8,5090,0,0
41356135,41356,0,0,8310.0,Salcoatitán,P,A,N,5,0,0,4,0,5126,8,5090,0,0
41356136,41356,0,0,8311.0,San Antonio del Monte,P,A,N,5,0,0,4,0,5127,8,5090,0,0
41356137,41356,0,0,8312.0,San Julián,P,A,N,5,0,0,4,0,5128,8,5090,0,0
41356138,41356,0,0,8313.0,Santa Catarina Masahuat,P,A,N,5,0,0,4,0,5129,8,5090,0,0
41356139,41356,0,0,8314.0,Santo Domingo de Guzmán,P,A,N,5,0,0,4,0,5130,8,5090,0,0
41356140,41356,0,0,8315.0,Sonsonate,P,A,N,5,0,0,4,0,5131,8,5090,0,0
41356141,41356,0,0,8316.0,Sonzacate,P,A,N,5,0,0,4,0,5132,8,5090,0,0
41356142,41356,0,0,8401.0,Agua Caliente,P,A,N,5,0,0,4,0,5133,8,5090,0,0
41356143,41356,0,0,8402.0,Arcatao,P,A,N,5,0,0,4,0,5134,8,5090,0,0
41356144,41356,0,0,8403.0,Azacualpa,P,A,N,5,0,0,4,0,5135,8,5090,0,0
41356145,41356,0,0,8404.0,Citalá,P,A,N,5,0,0,4,0,5136,8,5090,0,0
41356146,41356,0,0,8405.0,Comalapa,P,A,N,5,0,0,4,0,5137,8,5090,0,0
41356147,41356,0,0,8406.0,Concepción Quezaltepeque,P,A,N,5,0,0,4,0,5138,8,5090,0,0
41356148,41356,0,0,8407.0,Chalatenango,P,A,N,5,0,0,4,0,5139,8,5090,0,0
41356149,41356,0,0,8408.0,Dulce Nombre de María,P,A,N,5,0,0,4,0,5140,8,5090,0,0
41356150,41356,0,0,8409.0,El Carrizal,P,A,N,5,0,0,4,0,5141,8,5090,0,0
41356151,41356,0,0,8410.0,El  Paraíso,P,A,N,5,0,0,4,0,5142,8,5090,0,0
41356152,41356,0,0,8411.0,La Laguna,P,A,N,5,0,0,4,0,5143,8,5090,0,0
41356153,41356,0,0,8412.0,La Palma   ,P,A,N,5,0,0,4,0,5144,8,5090,0,0
41356154,41356,0,0,8413.0,La Reina,P,A,N,5,0,0,4,0,5145,8,5090,0,0
41356155,41356,0,0,8414.0,Las Vueltas,P,A,N,5,0,0,4,0,5146,8,5090,0,0
41356156,41356,0,0,8415.0,Nombre de Jesús,P,A,N,5,0,0,4,0,5147,8,5090,0,0
41356157,41356,0,0,8416.0,Nueva Concepción,P,A,N,5,0,0,4,0,5148,8,5090,0,0
41356158,41356,0,0,8417.0,Nueva Trinidad,P,A,N,5,0,0,4,0,5149,8,5090,0,0
41356159,41356,0,0,8418.0,Ojos de Agua,P,A,N,5,0,0,4,0,5150,8,5090,0,0
41356160,41356,0,0,8419.0,Potonico,P,A,N,5,0,0,4,0,5151,8,5090,0,0
41356161,41356,0,0,8420.0,San Antonio la Cruz,P,A,N,5,0,0,4,0,5152,8,5090,0,0
41356162,41356,0,0,8421.0,San Antonio los Ranchos,P,A,N,5,0,0,4,0,5153,8,5090,0,0
41356163,41356,0,0,8422.0,San Fernando,P,A,N,5,0,0,4,0,5154,8,5090,0,0
41356164,41356,0,0,8423.0,San Francisco Lempa,P,A,N,5,0,0,4,0,5155,8,5090,0,0
41356165,41356,0,0,8424.0,San Francisco Morazán,P,A,N,5,0,0,4,0,5156,8,5090,0,0
41356166,41356,0,0,8425.0,San Ignacio,P,A,N,5,0,0,4,0,5157,8,5090,0,0
41356167,41356,0,0,8426.0,San Isidro Labrador,P,A,N,5,0,0,4,0,5158,8,5090,0,0
41356168,41356,0,0,8427.0,San José Cancasque,P,A,N,5,0,0,4,0,5159,8,5090,0,0
41356169,41356,0,0,8428.0,San José las Flores,P,A,N,5,0,0,4,0,5160,8,5090,0,0
41356170,41356,0,0,8429.0,San Luis del Carmen,P,A,N,5,0,0,4,0,5161,8,5090,0,0
41356171,41356,0,0,8430.0,San Miguel de Mercedes,P,A,N,5,0,0,4,0,5162,8,5090,0,0
41356172,41356,0,0,8431.0,San Rafael,P,A,N,5,0,0,4,0,5163,8,5090,0,0
41356173,41356,0,0,8432.0,Santa Rita,P,A,N,5,0,0,4,0,5164,8,5090,0,0
41356174,41356,0,0,8433.0,Tejutla,P,A,N,5,0,0,4,0,5165,8,5090,0,0
41356175,41356,0,0,8501.0,Antiguo Cuscatlán,P,A,N,5,0,0,4,0,5166,8,5090,0,0
41356176,41356,0,0,8502.0,Ciudad Arce,P,A,N,5,0,0,4,0,5167,8,5090,0,0
41356177,41356,0,0,8503.0,Colón,P,A,N,5,0,0,4,0,5168,8,5090,0,0
41356178,41356,0,0,8504.0,Comasagua,P,A,N,5,0,0,4,0,5169,8,5090,0,0
41356179,41356,0,0,8505.0,Chiltiupán,P,A,N,5,0,0,4,0,5170,8,5090,0,0
41356180,41356,0,0,8506.0,Huizúcar,P,A,N,5,0,0,4,0,5171,8,5090,0,0
41356181,41356,0,0,8507.0,Jayaque,P,A,N,5,0,0,4,0,5172,8,5090,0,0
